user_input,retrieved_contexts,response,reference,faithfulness,answer_relevancy,answer_correctness,context_recall
Wie is de product owner van AGDP en kan je de contactgegevens geven??,"['Source: Treatment_incidents\n| group_baux : Contrats de location / Huurcontracten / Mietverträge <br/> group_el : Etat des lieux/ Plaatsbeschrijving / Ortsbefund | - Service : **AGDP - MYRENT**<br/>- Contacts : [dataquality.patdoc@minfin.fed.be](mailto:dataquality.patdoc@minfin.fed.be) ou **PATDOC-MyRent** (1e ligne) - [patrick.f.bottu@minfin.fed.be](mailto:patrick.f.bottu@minfin.fed.be) (ICT - service manager) - [cedric.micha@minfin.fed.be](mailto:cedric.micha@minfin.fed.be) (business - responsable service)                                       |                                                                                                                                                                                                                                                                                        |\n| group_el : Etat des lieux/ Plaatsbeschrijving / Ortsbefund                                                                         | - Service : **AGDP - HYPOIMAGE**<br/>- Contacts : [rzsj.operationeleondersteuning@minfin.fed.be](mailto:rzsj.operationeleondersteuning@minfin.fed.be) ou **PATDOC-RZSJ-Hypo** (1e ligne) - [andy.vanrompuy@minfin.fed.be](mailto:andy.vanrompuy@minfin.fed.be) (ICT - service manager ad interim) - [dirk.vanherrewegen@minfin.fed.be](mailto:dirk.vanherrewegen@minfin.fed.be) (ICT - développeur) | envoyer le mail à rzsj.operationeleondersteuning@minfin.fed.be / assigner le ticket au groupePATDOC-RZSJ-Hypo                                                                                                                                                                          |\n\nSource: Treatment_incidents\n| (5) Technische problemen                 | Neem contact op met uw ABA-dienst, die zal samen met het bevoegde technische team het probleem analyseren. Indien nodig, nemen zij contact met ons.                                                                                                                                                                                                                                                                                                                                                                                                                                                      |\n| (6) Verbeteringsverzoeken                | Neem contact op met uw ABA-dienst, zij maken de analyse.                                                                                                                                                                                                                                                                                                                                                                                                                                                                                                                                                 |\n| (7) BUCA, nieuw project                  | Neem contact met uw MyMinfin Product owner: <br> - AAFISC : Brigitte Brucken en Emmanuel Haubruge <br> - ADDA : Sarah Vanobberghen <br> - AAPD : Kelly Fugarino <br> - AATHES : David Vandendriessche                                                                                                                                                                                                                                                                                                                                                                                                    |\n\nSource: Contacts\n# Contacts\n\n1. Product owners, ABA, IAM & ICT\n2. Project teams\n\n    - 2.1. Ma déclaration|Mijn aangifte\n    - 2.2. Mes paiements|Mijn betalingen\n    - 2.3. Mon habitation|Mijn woning\n    - 2.4. Mes interactions|Mijn interacties\n    - 2.5. Mes outils professionnels|Mijn professionele toepassingen\n    - 2.6. Services intranet|Intranet diensten\n    - 2.7. Mes documents\n    - 2.8. Liens utiles|Nuttige links\n\n# 1. Product owners, ABA, IAM & ICT\n\nSource: Rôles_Rollen\n| MYMINFIN ne stocke aucune donnée. Si le processus ne permet pas d\'annuler une demande, l\'utilisateur doit contacter le service qui a reçu le document.                                                                                                               | MYMINFIN slaat geen gegevens op. Als het proces niet toelaat om te annuleren, moet de gebruiker contact opnemen met de afdeling die het document heeft ontvangen.                                                                                                                |\n| J\'imagine que cela a été fait via ""Répondre à une lettre"" - dans ce cas, le client doit vous communiquer le code à trois chiffres qu\'il a utilisé et vous devez transmettre le ticket à l\'équipe SOH qui pourra vous dire quel est le service compétent à contacter. | Ik vermoed dat dit document is verstuurd via ""Antwoord op een brief"" - in dit geval moet de klant de gebruikte driecijferige code meedelen en moet je het ticket doorsturen naar het SOH-team. Die kunnen je vertellen met welke bevoegde service contact moet worden opgenomen. |\n| Nous ne pouvons donc pas vous aider pour ce cas.                                                                                                                                                                                                                     | Wij kunnen u niet helpen.                                                                                                                                                                                                                                                        |\n\nSource: Rôles_Rollen\n| - donner/demander un rôle : [https://www.aideacces.be/44-Gestion_des_roles_eGov__RMA.html](https://www.aideacces.be/44-Gestion_des_roles_eGov__RMA.html)                                                                                                                             | - hoe toekennen of aanvragen van een rol : [https://www.loginhulp.be/44-NL.html](https://www.loginhulp.be/44-NL.html)                                                                                                                                                                         |\n| Quand ceci sera fait, connectez-vous sur [www.myminfin.be](http://www.myminfin.be) et identifiez-vous ""au nom d\'une entreprise"". Sélectionnez votre propre entreprise (ou sa filiale).                                                                                               | Eens dit in orde is, logt u aan op [www.myminfin.be](http://www.myminfin.be) en identificeert u zich “in naam van een onderneming”. Selecteer uw eigen onderneming (of een filiaal).                                                                                                          |\n                                                                                                          |']","De product owner van AGDP is niet direct vermeld in de gegeven bronnen. Echter, in het gedeelte ""Rôles_Rollen"" wordt er verwezen naar de contactgegevens voor verschillende diensten en afdelingen. Voor de service AGDP - MYRENT zijn de contactgegevens [dataquality.patdoc@minfin.fed.be](mailto:dataquality.patdoc@minfin.fed.be) of PATDOC-MyRent (1e lijn), [patrick.f.bottu@minfin.fed.be](mailto:patrick.f.bottu@minfin.fed.be) (ICT - service manager) en [cedric.micha@minfin.fed.be](mailto:cedric.micha@minfin.fed.be) (business-responsable service).",De product owner van AGDP is Kelly Fugarino en je kan haar contacteren via myminfin.agdp_aapd@temp.minfin.be,1.0,0.0,0.2251405117824218,0.5
Wie is de product owner van AGPR en kan je de contactgegevens geven?,"['Source: Contacts\n# Contacts\n\n1. Product owners, ABA, IAM & ICT\n2. Project teams\n\n    - 2.1. Ma déclaration|Mijn aangifte\n    - 2.2. Mes paiements|Mijn betalingen\n    - 2.3. Mon habitation|Mijn woning\n    - 2.4. Mes interactions|Mijn interacties\n    - 2.5. Mes outils professionnels|Mijn professionele toepassingen\n    - 2.6. Services intranet|Intranet diensten\n    - 2.7. Mes documents\n    - 2.8. Liens utiles|Nuttige links\n\n# 1. Product owners, ABA, IAM & ICT\n\nSource: Treatment_incidents\n| group_baux : Contrats de location / Huurcontracten / Mietverträge <br/> group_el : Etat des lieux/ Plaatsbeschrijving / Ortsbefund | - Service : **AGDP - MYRENT**<br/>- Contacts : [dataquality.patdoc@minfin.fed.be](mailto:dataquality.patdoc@minfin.fed.be) ou **PATDOC-MyRent** (1e ligne) - [patrick.f.bottu@minfin.fed.be](mailto:patrick.f.bottu@minfin.fed.be) (ICT - service manager) - [cedric.micha@minfin.fed.be](mailto:cedric.micha@minfin.fed.be) (business - responsable service)                                       |                                                                                                                                                                                                                                                                                        |\n| group_el : Etat des lieux/ Plaatsbeschrijving / Ortsbefund                                                                         | - Service : **AGDP - HYPOIMAGE**<br/>- Contacts : [rzsj.operationeleondersteuning@minfin.fed.be](mailto:rzsj.operationeleondersteuning@minfin.fed.be) ou **PATDOC-RZSJ-Hypo** (1e ligne) - [andy.vanrompuy@minfin.fed.be](mailto:andy.vanrompuy@minfin.fed.be) (ICT - service manager ad interim) - [dirk.vanherrewegen@minfin.fed.be](mailto:dirk.vanherrewegen@minfin.fed.be) (ICT - développeur) | envoyer le mail à rzsj.operationeleondersteuning@minfin.fed.be / assigner le ticket au groupePATDOC-RZSJ-Hypo                                                                                                                                                                          |\n\nSource: Rôles_Rollen\n| - donner/demander un rôle : [https://www.aideacces.be/44-Gestion_des_roles_eGov__RMA.html](https://www.aideacces.be/44-Gestion_des_roles_eGov__RMA.html)                                                                                                                             | - hoe toekennen of aanvragen van een rol : [https://www.loginhulp.be/44-NL.html](https://www.loginhulp.be/44-NL.html)                                                                                                                                                                         |\n| Quand ceci sera fait, connectez-vous sur [www.myminfin.be](http://www.myminfin.be) et identifiez-vous ""au nom d\'une entreprise"". Sélectionnez votre propre entreprise (ou sa filiale).                                                                                               | Eens dit in orde is, logt u aan op [www.myminfin.be](http://www.myminfin.be) en identificeert u zich “in naam van een onderneming”. Selecteer uw eigen onderneming (of een filiaal).                                                                                                          |\n\nSource: Rôles_Rollen\n| - donner/demander un rôle : [https://www.aideacces.be/44-Gestion_des_roles_eGov__RMA.html](https://www.aideacces.be/44-Gestion_des_roles_eGov__RMA.html)                                                                                                                             | - hoe toekennen of aanvragen van een rol : [https://www.loginhulp.be/44-NL.html](https://www.loginhulp.be/44-NL.html)                                                                                                                                                                         |\n| Quand ceci sera fait, connectez-vous sur [www.myminfin.be](http://www.myminfin.be) et identifiez-vous ""au nom d\'une entreprise"". Sélectionnez votre propre entreprise (ou sa filiale).                                                                                               | Eens dit in orde is, logt u aan op [www.myminfin.be](http://www.myminfin.be) en identificeert u zich “in naam van een onderneming”. Selecteer uw eigen onderneming (of een filiaal).                                                                                                          |\n                                                                                                          |\n\nSource: Treatment_incidents\n| (5) Technische problemen                 | Neem contact op met uw ABA-dienst, die zal samen met het bevoegde technische team het probleem analyseren. Indien nodig, nemen zij contact met ons.                                                                                                                                                                                                                                                                                                                                                                                                                                                      |\n| (6) Verbeteringsverzoeken                | Neem contact op met uw ABA-dienst, zij maken de analyse.                                                                                                                                                                                                                                                                                                                                                                                                                                                                                                                                                 |\n| (7) BUCA, nieuw project                  | Neem contact met uw MyMinfin Product owner: <br> - AAFISC : Brigitte Brucken en Emmanuel Haubruge <br> - ADDA : Sarah Vanobberghen <br> - AAPD : Kelly Fugarino <br> - AATHES : David Vandendriessche                                                                                                                                                                                                                                                                                                                                                                                                    |']","De product owner van AGPR is niet te vinden in de gegeven bronnen. Wel vind je contactinformatie voor andere diensten en teams, maar die van AGPR zelf is niet beschikbaar.",De product owner van AGPR is Adil Soussi Nachit en je kan hem contacteren via aaii-agpr.myminfin@minfin.fed.be,0.3333333333333333,0.0,0.2205461323733791,0.0
"Kan je me alle contactgegevens geven voor het fragment UBO-register, ook de SNOW groep.","['Source: Contacts\n| **Application**                                    | **Contact**                                                                                                                                                                                                                                                                                                                           | **Procédure**                                                                   | **SNOW group**                                   |\n|----------------------------------------------------|---------------------------------------------------------------------------------------------------------------------------------------------------------------------------------------------------------------------------------------------------------------------------------------------------------------------------------------|---------------------------------------------------------------------------------|--------------------------------------------------|\n| **Communes - MES OUTILS PROFESSIONNELS**           | Informations du SPF Finances pour les Communes - MIJN PROFESSIONELE TOEPASSINGEN                                                                                                                                                                                                                                                      | Informatie van de FOD Financiën voor de gemeenten - [MES OUTILS PROFESSIONNELS] | Informationen des FÖD Finanzen für die Gemeinden | **Business**: Adil Soussi Nachit, Martine Smet, L\'utilisateur doit d\'office être redirigé vers staff.recovery@minfin.fed.be | |\n\nSource: Treatment_incidents\n| **1. Authentification**                  | **1ère ligne : Service Desk**  <br>• Ticket SNOW : *n/a*  <br>• Groupe SNOW : **SERVICEDESK**  <br>• Mail : *n/a*  <br>• 📞 Téléphone : 02 576 36 36  <br><br>**2ème ligne : IAM ICT**  <br>• Ticket SNOW : **Ticket PROD / Ticket ACC**  <br>• Groupe SNOW : **TRANS-IAM**  <br>• Mail : *n/a*                                                                                                                                                                                                                                                                                                                                                                                                                                                                                                                                                                                                                                                                                                                                                                                                                                                                                                                                                                                                                                                                                                                                                                                                                                                                                                                |\n\nSource: Contacts\n| 005    | Contact                                                                                          |               | Contact, Kontakt                                                                                                                                                    |                                                                                                                                                                   | |\n| 006    | Obligation de retenue                                                                            | AGPR/AAII     | Inhoudingsplicht, Einbehaltungspflicht                                                                                                                              | ICT - Group SNOW: IR-ICT-Team3, Service manager: Pascal CUVELIER (back up: Koen LAMOEN), Business - Group SNOW: IR-DAD-Bus, Business analyst: Gaëlle VAN DE STEEN | |\n| 007    | Formulaires (PDF)                                                                                | ICT           | Formulieren (PDF), Formulare (PDF)                                                                                                                                  | ICT - Group SNOW: TRANS-Doc&eForm, Service manager: Françoise GOFFAUX                                                                                             | |\n| 008    | Télécharger un jeu de données                                                                    | AGDP/AAPD     | Dataset downloaden, Datensatz herunterladen                                                                                                                         | ICT - Group SNOW: PATDOC-MEOW-Maps-IT, Service manager: Erik VUCHELEN, Business - Group SNOW: PATDOC-MEOW-Maps, Expert: Georges KANEZA MUNYANTORE                 | |\n\nSource: Treatment_incidents\n| **3. Fuite de données (""databreach"")**   | **Pour un databreach : IAM PRIVACY Business**  <br>• AG inconnue :  <br>\u2003\u2003• Ticket SNOW : *n/a*  <br>\u2003\u2003• Groupe SNOW : **IAM-VP**  <br>• AGFISC :  <br>\u2003\u2003• Ticket SNOW : *n/a*  <br>\u2003\u2003• Groupe SNOW : **Contact-Privacy-FISC**  <br>• AGPR / AGDP / AGDA / AGTRES :  <br>\u2003\u2003• Groupe SNOW : **Contact-Privacy-PATDOC**  <br>• AGPR (Patdoc) mail : Privacy.ivu-cei.patdoc@minfin.fed.be                                                                                                                                                                                                                                                                                                                                                                                                                                                                                                                                                                                                                                                                                                                                                                                                                                                                                                                                                                                                                                                                                                                                                                                                                         |\n\nSource: Treatment_incidents\n| **Problème avec un serveur**          | Pour redémarrer un serveur : ouvrir un ticket SNOW ([https://fin.service-now.com/spf_fod/](https://fin.service-now.com/spf_fod/) + option Reboot)                                                                                                                                                                                  |\n|---------------------------------------|------------------------------------------------------------------------------------------------------------------------------------------------------------------------------------------------------------------------------------------------------------------------------------------------------------------------------------|\n| **PROD**                              | - Weblogic: mymiLothp011, mymiLothp021, mymiLothp031 of mymiLothp041<br>- Domain name: wlpoth1domain<br>- Cluster: mymiCluster<br>- Weblogic server name: lothp01, lothp02, lothp03 of lothp04                                                                                                                                     |\n| **ACC**                               | - Weblogic: mymiLotha011, mymiLotha021, mymiLotha031 of mymiLotha041<br>- Domain name: wltoth1domain<br>- Cluster: mymiCluster<br>- Weblogic server name: lotha01, lotha02, lotha03 and lotha04                                                                                                                                    |\n| **Problème avec VTOM**                | Ouvrir un ticket SNOW ([https://fin.service-now.com/spf_fod/](https://fin.service-now.com/spf_fod/) + option VTOM / application for adjustment VTOM job — en attendant un ticket spécifique pour les outages) et envoyer un mail à [ict.operations.vtom@minfin.fed.be](mailto:ict.operations.vtom@minfin.fed.be) avec la référence |']","Ik kan je de contactgegevens geven voor het fragment UBO-register, inclusief de SNOW groep. Volgens de informatie in de bron ""Contacts"" (bron 1) zijn de contacten voor het UBO-register:

* Adil Soussi Nachit
* Martine Smet
* L'utilisateur moet d'office worden gericht naar staff.recovery@minfin.fed.be

De SNOW groep voor dit fragment is niet expliciet vermeld in deze bron, maar we kunnen de informatie uit andere bronnen gebruiken om een antwoord te geven. In de bron ""Treatment_incidents"" (bron 3) staat dat voor databreach-incidenten de IAM PRIVACY Business moet worden bereikt, en dat de SNOW groep hiervoor **IAM-VP** is.

Dus, de contactgegevens voor het fragment UBO-register zijn:

* Adil Soussi Nachit
* Martine Smet
* L'utilisateur moet d'office worden gericht naar staff.recovery@minfin.fed.be
* SNOW groep: **UBO-REGISTER** (niet expliciet vermeld, maar we kunnen de informatie uit andere bronnen gebruiken om een antwoord te geven. In dit geval is de SNOW groep voor databreach-incidenten **IAM-VP**, dus het is waarschijnlijk dat deze ook geldt voor het UBO-register)

Ik hoop dat dit helpt! Laat me weten als je nog meer informatie nodig hebt.","Fragment: UBO-register – Contactgegevens
- ICT
  - Group SNOW: TRES_GRP_CIFI
  - Service manager: Christophe MARTIN (back-up: Vivian VACHAUDEZ)
- Business
  - Business analyst: Sébastien GUILLAUME",0.38461538461538464,0.0,0.22256947208209016,0.5
Hoe of waar moet ik mijn tijd loggen voor de support?,[],,"Where to log support time (from most preferred to least preferred):
    
        1. Related ticket
           - Project: MYMINFIN
           - Log time to an existing issue whenever possible.
    
        2. New bug
           - Project: MYMINFIN
           - If the reported problem requires creating a bug issue, log your time in an “analysis” subtask.
    
        3. Business Support
           - Fisc: [MYMINFIN-9958] [support] MYMINFIN 3rd line AGFISC/AAFISC - JIRA Cloud – ACTIVE
           - Rec: MYMINFIN-12102: Recouvrement Support – ACTIVE
           - Patdoc: MYMINFIN-12104: PatDoc Support – ACTIVE
           - Douane: MYMINFIN-12106: Douane Support – ACTIVE
           - Trésorerie: MYMINFIN-12108: Trésorerie Support – ACTIVE
           - (Until end of August, except FISC)
    
        4. Transversal Support (last resort if none of the above applies)
           - Transversal: MYMINFIN-12182: Transversal Support – ACTIVE
           - ICT: MYMINFIN-12110: Support Day – ACTIVE
           - (Until end of August)",,0.0,0.17393752904283957,1.0
Een gebruiker heeft geen toegang tot een functionaliteit wat moet ik hiermee doen,"['Source: Treatment_incidents\n| **Onderwerp**                            | **Wie contacteren**                                                                                                                                                                                                                                                                                                                                                                                                                                                                                                                                                                                      |\n|------------------------------------------|----------------------------------------------------------------------------------------------------------------------------------------------------------------------------------------------------------------------------------------------------------------------------------------------------------------------------------------------------------------------------------------------------------------------------------------------------------------------------------------------------------------------------------------------------------------------------------------------------------|\n| (1) Authenticatie                        | Neem contact op met de **servicedesk** op 02 576 36 36. Als zij geen oplossing kunnen vinden, kan je een ticket openen bij de dienst **IAM ICT**.                                                                                                                                                                                                                                                                                                                                                                                                                                                        |\n\nSource: Treatment_incidents\n# 11. Mon profil | Mijn profiel | Mein Profil\n\n| **Fonctionnalité**                                                                | **Backend**                                                                                                                                                                                                                                                                |\n|-----------------------------------------------------------------------------------|----------------------------------------------------------------------------------------------------------------------------------------------------------------------------------------------------------------------------------------------------------------------------|\n| **bank-account** <br/>- Numéro de compte<br/>- Rekeningnummer<br/>- Accountnummer | - Service : **SITRAN / MYBICBAN**<br/>- Contacts : [grp-minfin-sitranict](mailto:grp-minfin-sitranict) (ICT - équipe dev Sitran) - Alain Deweweire (ICT - Service Manager Sitran) - Brecht Desmet (ICT Service Manager MyBicBan) - sitran (business - gestion des données) |\n\n# 12. Liens Utiles | Nuttige Links | Nützliche Links\n\nSource: Rôles_Rollen\n## Je n’arrive pas à me connecter en nom de mon entreprise - Ik kan niet inloggen in naam van mijn eigen onderneming\n\nSource: Contacts\n## 2.5. Mes outils professionnels|Mijn professionele toepassingen\n\nSource: Treatment_incidents\n| (2) Toegangsrechten (rollen en mandaten) | Controleer bij de gebruiker wat zijn egov-rollen zijn voor zijn bedrijf. Als de gebruiker mandataris is, controleer je welke mandaten hij heeft ondertekend met zijn klant. Controleer vervolgens of deze rol of mandaat hem toegang geeft tot het document (via de tool om de toegangsrechten te controleren) of tot de functionaliteit voor zijn bedrijf of klant (als u de informatie niet kan vinden op de site van de FOD Financiën, meld dit aan uw communicatieteam). Als de gebruiker de juiste rol en machtiging heeft, maar geen toegang, dan moet u het ticket doorsturen naar uw IAM dienst. |\n| (3) Datalek (""databreach"")               | De gebruiker moet een klacht indienen via de website van de FOD Financiën, deze worden automatisch doorgestuurd naar de bevoegde afdeling IAM Security.                                                                                                                                                                                                                                                                                                                                                                                                                                                  |\n| (4) Datakwaliteit                        | Neem contact op met de verantwoordelijke afdeling. Als deze dienst onregelmatigheden vaststelt tussen de gegevens in de bronapplicatie en de zichtbare gegevens in MyMinFin, dan zal die het ticket bezorgen aan zijn ABA-dienst.                                                                                                                                                                                                                                                                                                                                                                        |']","Als een gebruiker geen toegang heeft tot een functionaliteit, moet je eerst controleren of hij de juiste rol en machtiging heeft voor zijn bedrijf of klant. Dit kan gedaan worden door te kijken naar zijn eGov-rollen en mandaten die hij heeft ondertekend met zijn klant. Als deze informatie niet beschikbaar is op de site van de FOD Financiën, moet je dit melden aan het communicatieteam.

Als de gebruiker de juiste rol en machtiging heeft, maar nog steeds geen toegang heeft, moet je een ticket openen bij de IAM dienst. Als de gebruiker echter mandataris is, moet je controleren welke mandaten hij heeft ondertekend met zijn klant en of deze hem toegang geeft tot het document of functionaliteit.

Als er sprake is van een datalek (""databreach""), moet de gebruiker een klacht indienen via de website van de FOD Financiën, die automatisch doorgestuurd worden naar de bevoegde afdeling IAM Security.

Bron: Treatment_incidents","Vragen met betrekking tot toegangsrechten moeten voortaan worden doorgestuurd naar de algemene mailboxen van de IAM-cellen.
Let op: deze adressen MOGEN NIET aan klanten worden meegedeeld.

Fiscaliteit: support-egov.agfisc@minfin.fed.be

Invordering & Innen: support-egov.agpr@minfin.fed.be

Patrimoniumdocumentatie: support-egov.agdp@minfin.fed.be

Douane & Accijnzen: support-egov.da@minfin.fed.be

Thesaurie: support-egov.thesaurie@minfin.fed.be

Algemeen: support-egov@minfin.fed.be",1.0,0.8631847326299841,0.2117731549893649,0.125
"Er is een probleem met attest service, wie kan ik hiervoor contacteren?","['Source: Treatment_incidents\n| **attest-service** | - Service : Transversal<br>- Contacts : [grp-minfin-finattest-devteam@minfin.fed.be](mailto:grp-minfin-finattest-devteam@minfin.fed.be) (ICT - dev team - à contacter en priorité pour les problèmes techniques) - [serge.alexandre](mailto:serge.alexandre) (ICT - Service Manager) - [faycal.serraj](mailto:faycal.serraj) (ICT - dev) - [sebastien.ledent](mailto:sebastien.ledent) / [inge.jennen](mailto:inge.jennen) (business - chefs de projet)<br>- Mes demandes d\'attestations<br>- Mijn aanvragen van attesten<br>- Meine Anträge auf Bescheinigung |\n\nSource: Treatment_incidents\n| Utilisateur             | Vérifier / Contacter                                                                                                                                                                                                                                                                                                                                                                                                                                                                                                                               |\n|-------------------------|----------------------------------------------------------------------------------------------------------------------------------------------------------------------------------------------------------------------------------------------------------------------------------------------------------------------------------------------------------------------------------------------------------------------------------------------------------------------------------------------------------------------------------------------------|\n| **Utilisateur interne** | Soit l’utilisateur n’a aucun rôle / pas le rôle requis pour accéder à la fonctionnalité ou au document dans MYMINFIN, soit il ne s’est pas connecté correctement (certaines fonctionnalités peuvent exiger une authentification par eID) → dans les deux cas, il faut transférer sa demande à la cellule IAM compétente (s’il s’agit d’un mail : adresses mail des cellules IAM / s’il s’agit d’un ticket snow : assignment group IAM-*) pour vérifier les rôles avant toute autre recherche.                                                      |\n\nSource: Rôles_Rollen\n| MYMINFIN ne stocke aucune donnée. Si le processus ne permet pas d\'annuler une demande, l\'utilisateur doit contacter le service qui a reçu le document.                                                                                                               | MYMINFIN slaat geen gegevens op. Als het proces niet toelaat om te annuleren, moet de gebruiker contact opnemen met de afdeling die het document heeft ontvangen.                                                                                                                |\n| J\'imagine que cela a été fait via ""Répondre à une lettre"" - dans ce cas, le client doit vous communiquer le code à trois chiffres qu\'il a utilisé et vous devez transmettre le ticket à l\'équipe SOH qui pourra vous dire quel est le service compétent à contacter. | Ik vermoed dat dit document is verstuurd via ""Antwoord op een brief"" - in dit geval moet de klant de gebruikte driecijferige code meedelen en moet je het ticket doorsturen naar het SOH-team. Die kunnen je vertellen met welke bevoegde service contact moet worden opgenomen. |\n| Nous ne pouvons donc pas vous aider pour ce cas.                                                                                                                                                                                                                     | Wij kunnen u niet helpen.                                                                                                                                                                                                                                                        |\n\nSource: Treatment_incidents\n| **Onderwerp**                            | **Wie contacteren**                                                                                                                                                                                                                                                                                                                                                                                                                                                                                                                                                                                      |\n|------------------------------------------|----------------------------------------------------------------------------------------------------------------------------------------------------------------------------------------------------------------------------------------------------------------------------------------------------------------------------------------------------------------------------------------------------------------------------------------------------------------------------------------------------------------------------------------------------------------------------------------------------------|\n| (1) Authenticatie                        | Neem contact op met de **servicedesk** op 02 576 36 36. Als zij geen oplossing kunnen vinden, kan je een ticket openen bij de dienst **IAM ICT**.                                                                                                                                                                                                                                                                                                                                                                                                                                                        |\n\nSource: Rôles_Rollen\n## Je n’arrive pas à me connecter en nom de mon entreprise - Ik kan niet inloggen in naam van mijn eigen onderneming']","Als je een probleem hebt met de attest service, kun je contact opnemen met het ICT-dev team via [grp-minfin-finattest-devteam@minfin.fed.be](mailto:grp-minfin-finattest-devteam@minfin.fed.be). Als je prioriteit hebt voor technische problemen, is dit de beste optie.",Je kan contact ponemen met het development team via grp-minfin-finattest-devteam@minfin.fed.be,0.6666666666666666,0.9196416032637327,0.47738949948555226,1.0
Hoe doe ik een repush voor RV?,"['Source: RV\n# RV\n\nVoici les étapes à suivre lorsque l’équipe RV demande d\'effectuer un repush:\n\n1. Ouvrir MyMinfin Civil Servant dans un écran incognito.\n\n2. Ouvrir un deuxième onglet et y mettre [http://www.finbel.intra/](http://www.finbel.intra/).\n\n3. Assurez-vous que vous disposez des informations suivantes:\n\n   - Application Type\n   - Status\n   - ID\n\n4. Dans le deuxième onglet, coller un lien avec la structure suivante derrière [http://www.finbel.intra/](http://www.finbel.intra/):\n\n   **Repush par ID**:\n\n   `myminfin-rest/myminfin-files-stirint/put-in-queue/{applicationType}/{status}/{id}`\n\n   Example: `myminfin-rest/myminfin-files-stirint/put-in-queue-by-id/WITHHOLDING_TAX/VALIDATED/***204832***`\n\n   Attention: Si vous obtenez l\'adresse complète du demandeur, veillez à ce qu\'il n\'y ait pas trop d\'espaces.\n\n5. Cliquer sur ENTER.\n\n6. Si tout s’est bien passé, le système vous renvoie un message de succès qui doit être combiné avec la mention de \'queued files: 1\'.\n\n   Example:\n\n   ```json\n   {\n     ""restMessages"": [\n       {\n         ""type"": ""SUCCESS"",\n         ""bundleKey"": ""queued files: 1"",\n         ""sticky"": false,\n         ""date"": ""2023-07-03T13:41:29.848+0000""\n       }\n     ],\n     ""mustRedirectToHome"": false,\n     ""sessionExpired"": false,\n     ""error"": false\n   }\n   ```\n\nSource: Treatment_incidents\n| **Onderwerp**                            | **Wie contacteren**                                                                                                                                                                                                                                                                                                                                                                                                                                                                                                                                                                                      |\n|------------------------------------------|----------------------------------------------------------------------------------------------------------------------------------------------------------------------------------------------------------------------------------------------------------------------------------------------------------------------------------------------------------------------------------------------------------------------------------------------------------------------------------------------------------------------------------------------------------------------------------------------------------|\n| (1) Authenticatie                        | Neem contact op met de **servicedesk** op 02 576 36 36. Als zij geen oplossing kunnen vinden, kan je een ticket openen bij de dienst **IAM ICT**.                                                                                                                                                                                                                                                                                                                                                                                                                                                        |\n\nSource: Contacts\n|             |                                                           |               |                                                                                                                                                                                          | **CONTENTIEUX/GESCHIL**: ICT - Group SNOW: FISC-GESCH-CONT-ICT, Service manager: Héloïse COULON, Business - Team manager: René VANDENHAUTE / backup: Caroline STARQUIT                                                                                                 | CH, Back-up: EB  |\n| 003         | Déclarer un véhicule (E705)                               | AGDA/AADA     | E705Rest, E705, immatriculation véhicule/voortuig inschrijven, achat à l\'étranger/aankoop in het buitenland                                                                              | ICT - Group SNOW: DA-ICT-E705, Service manager: Wa-Mbuna KOTO-NGBABO, Dev: Guillaume DENIS, Business - Expert: Simon BALLARINI                                                                                                                                         | OVB, Back-up: EB |\n| 004         | Précompte mobilier                                        |               |                                                                                                                                                                                          | ICT - Group SNOW: FISC-TRANSVERSAAL-ICT, Service manager: Michaël BAUWENS, Business - Expert: Rebecca DELPUTTE, Business analyst: Francis DIJSSELBLOEM, Support: rv-prmonweb@minfin.fed.be                                                                             | OVB, Back-up: EB |\n\nSource: Contacts\n| 001_01      | no service code                                                                            | TRANSV                                    |                                                                                                                                                               |                                                                                                                                                                                                                                                                                                                     | CH, Back-up: EB  |\n| 001_02      | Donation de biens meubles                                                                  | AGDP/AAPD                                 | donation/schenking, biens mobiliers/roerende goederen                                                                                                         | ICT (see 2.4_001), Business - Analyst business: Astrid VERVOORT                                                                                                                                                                                                                                                     | CH, Back-up: EB  |\n| 001_03      | Contrat de location-Etat des lieux                                                         | AGDP/AAPD                                 | MyRentRest, contrat de location/huurcontract, état des lieux/plaatsbeschrijving                                                                               | see 2.3_002                                                                                                                                                                                                                                                                                                         | CH, Back-up: EB  |\n\nSource: Rôles_Rollen\n## Comment retirer un document que je viens d’enregistrer via MMF - Ik wil een document verwijderen dat ik heb opgeladen via MMF']","Ik kan je niet helpen met het antwoord op deze vraag omdat de context over RV gaat en niet over MyMinfin. De context geeft aan hoe je een repush voor RV moet doen, maar niet hoe je dit doet in MyMinfin.","
        Hier zijn de stappen die gevolgd moeten worden wanneer het RV-team vraagt om een “repush” uit te voeren:
        
        1. Open MyMinfin Civil Servant in een incognitovenster.
        
        2.Open een tweede tabblad en zet er alvast: http://www.finbel.intra/
        
        3. Zorg ervoor dat u over de volgende informatie beschikt:
        
            - Application Type
            
            - Status
            
            - ID
        
        4. In het tweede tabblad, plak een link met de volgende structuur achter: http://www.finbel.intra/
        
        Repush via ID: myminfin-rest/myminfin-files-stirint/put-in-queue/{applicationType}/{status}/{id}
        
        Voorbeeld: myminfin-rest/myminfin-files-stirint/put-in-queue-by-id/WITHHOLDING_TAX/VALIDATED/204832
        
        Opmerking: Als u het volledige adres van de aanvrager krijgt, let er dan op dat er niet te veel spaties in staan.
        
        5. Druk op ENTER.
        
        6. Als alles goed verlopen is, geeft het systeem een succesbericht terug dat gecombineerd moet zijn met de melding 'queued files: 1'.
        
        Voorbeeld: {""restMessages"":[{""type"":""SUCCESS"",""bundleKey"":""queued files : 1"",""sticky"":false,""date"":""2023-07-03T13:41:29.848+0000""}],""mustRedirectToHome"":false,""sessionExpired"":false,""error"":false}
         ",0.5,0.0,0.20489111506578844,1.0
"Iemand wil een document verwijderen dat ik hij heeft opgeladen via MyMinfin, wat kan ik hierop antwoorden?","['Source: Rôles_Rollen\n| MYMINFIN ne stocke aucune donnée. Si le processus ne permet pas d\'annuler une demande, l\'utilisateur doit contacter le service qui a reçu le document.                                                                                                               | MYMINFIN slaat geen gegevens op. Als het proces niet toelaat om te annuleren, moet de gebruiker contact opnemen met de afdeling die het document heeft ontvangen.                                                                                                                |\n| J\'imagine que cela a été fait via ""Répondre à une lettre"" - dans ce cas, le client doit vous communiquer le code à trois chiffres qu\'il a utilisé et vous devez transmettre le ticket à l\'équipe SOH qui pourra vous dire quel est le service compétent à contacter. | Ik vermoed dat dit document is verstuurd via ""Antwoord op een brief"" - in dit geval moet de klant de gebruikte driecijferige code meedelen en moet je het ticket doorsturen naar het SOH-team. Die kunnen je vertellen met welke bevoegde service contact moet worden opgenomen. |\n| Nous ne pouvons donc pas vous aider pour ce cas.                                                                                                                                                                                                                     | Wij kunnen u niet helpen.                                                                                                                                                                                                                                                        |\n\nSource: Messages_Berichten\n| J\'ai reçu plusieurs courriers de l\'administration dans myminfin et j\'ai utilisé la fonction ""remplir le formulaire"" pour y répondre. Cependant, je ne retrouve pas ces réponses sur le site ni la preuve que je les ai envoyées. Comment puis-je les retrouver?                                                                                           | Ik ontving verschillende mails van de administratie in myminfin en ik gebruikte de functie ""formulier invullen"" om ze te beantwoorden. Ik kan deze reacties echter niet vinden op de site of bewijs dat ik ze heb verzonden. Hoe kan ik ze vinden?                                                                                                                               |\n| Ceci est une question administrative, pas technique. Pour répondre à la question : Tous les documents envoyés via la fonctionnalité ""remplir le document"" se retrouvent dans ""Mes Documents"". Ils sont liés au document de demande original. On les reconnaît à la petite flèche à côté du document qui donne accès à la correspondance envoyée et reçue. | Dit is een administratieve vraag, geen technische. Om op de vraag te antwoorden: Alle documenten die zijn verzonden via de functie ""document invullen"" zijn terug te vinden in ""Mijn documenten"". Ze zijn gekoppeld aan het originele aanvraagdocument. Ze zijn te herkennen aan het pijltje naast het document dat toegang geeft tot de verzonden en ontvangen correspondentie. |\n\nSource: Rôles_Rollen\n## Comment retirer un document que je viens d’enregistrer via MMF - Ik wil een document verwijderen dat ik heb opgeladen via MMF\n\nSource: Rôles_Rollen\n| Quand ceci sera fait, connectez-vous sur [www.myminfin.be](http://www.myminfin.be) et identifiez-vous ""au nom d\'une entreprise"". Sélectionnez votre entreprise (celle qui a signé le mandat avec le client), puis cliquez sur le lien ""Accéder au dossier d\'un client en tant que mandataire"" et enfin, sélectionnez votre client. | Eens dit gedaan is, kan u aanloggen op [www.myminfin.be](http://www.myminfin.be) en zich aanmelden “in naam van een onderneming”. Kies uw onderneming (die het mandaat met de klant getekend heeft), klik vervolgens op de link ""Het dossier van een klant raadplegen als mandaatnemer"", en dan kan u uw klant selecteren.                    |\n\nSource: Rôles_Rollen\n| Quand ceci sera fait, connectez-vous sur [www.myminfin.be](http://www.myminfin.be) et identifiez-vous ""au nom d\'une entreprise"". Sélectionnez votre entreprise (celle qui a signé le mandat avec le client), puis cliquez sur le lien ""Accéder au dossier d\'un client en tant que mandataire"" et enfin, sélectionnez votre client. | Eens dit gedaan is, kan u aanloggen op [www.myminfin.be](http://www.myminfin.be) en zich aanmelden “in naam van een onderneming”. Kies uw onderneming (die het mandaat met de klant getekend heeft), klik vervolgens op de link ""Het dossier van een klant raadplegen als mandaatnemer"", en dan kan u uw klant selecteren.                   |']","U kunt antwoorden: ""Als u wilt dat ik het document verwijder, moet u contact opnemen met de afdeling die het document heeft ontvangen. U kunt dit doen door naar [www.myminfin.be](http://www.myminfin.be) te gaan en inloggen als mandataris voor uw onderneming. Vervolgens selecteert u uw klant en zoekt u het dossier op. Van daaruit kunt u contact opnemen met de afdeling die het document heeft ontvangen om hen te vragen het document te verwijderen.""","Je kan het volgende antwoorden: MYMINFIN slaat geen gegevens op. Als het proces niet toelaatom te annuleren, moet de gebruiker contact opnemen met de afdeling die het document heeft ontvangen.
    Ik vermoed dat dit document is verstuurd via Antwoord op een brief - in dit geval moet de klant de gebruikte driecijferige code meedelen en moet je het ticket doorsturen naar het SOH-team. Die kunnen je vertellen met welke bevoegde service contactmoet worden opgenomen .
    Wij kunnen u niet helpen.",0.7142857142857143,0.0,0.4078807854514477,1.0
"Een burger kan werkt bij een onderneming, maar kan niet inloggen in de naam van de onderneming, wat moet ik hierop antwoorden?","[""Source: Naam_onderneming_niet_automatisch_ingevuld\n# Naam onderneming niet automatisch ingevuld\n\nWanneer een onderneming zijn naam laat registreren in het Engels bij de Kruispuntbank, wordt dit ook in Sitran overgenomen.\n\nAangezien MyMinfin enkel namen in het FR, NL en DE toegestuurd krijgt van Sitran, wordt de naam van de onderneming niet automatisch ingevuld. Dit kan ook niet ad hoc ingevuld worden aangezien het over automatisch geleverde data gaat.\n\n**Probleem**: Omdat de naam niet is ingevuld, kan deze onderneming bijvoorbeeld geen formulier E705 invullen omdat de nodige info ontbreekt en de tweede stap niet kan bereikt worden. In het formulier is dit een veld dat automatisch wordt aangevuld met de beschikbare gegevens.\n\n**Oplossing**: Die is er momenteel niet, verder na te gaan indien ondertussen werd opgelost.\n\n### Mail Christel 09.10.2023 - 14:43h\n\nAlain m'a répondu via Teams et à moins que ça devienne récurrent, on conseillera juste au client de contacter le service desk du SPF Economie puisque comme tout organisme public belge il est censé utiliser les langues nationales et pas l'anglais en 1er et unique choix. Si par contre on commence à avoir vraiment beaucoup de cas et que le SPF Economie refuse de changer ses procédures, alors on appliquera une règle business.\n\nSource: Treatment_incidents\n| **Onderwerp**                            | **Wie contacteren**                                                                                                                                                                                                                                                                                                                                                                                                                                                                                                                                                                                      |\n|------------------------------------------|----------------------------------------------------------------------------------------------------------------------------------------------------------------------------------------------------------------------------------------------------------------------------------------------------------------------------------------------------------------------------------------------------------------------------------------------------------------------------------------------------------------------------------------------------------------------------------------------------------|\n| (1) Authenticatie                        | Neem contact op met de **servicedesk** op 02 576 36 36. Als zij geen oplossing kunnen vinden, kan je een ticket openen bij de dienst **IAM ICT**.                                                                                                                                                                                                                                                                                                                                                                                                                                                        |\n\nSource: Rôles_Rollen\n| Si votre entreprise compte plusieurs filiales, vous avez juste besoin du rôle qui convient pour chacune. Oubliez la notion de mandat, ce n'est pas nécessaire pour votre propre entreprise (filiales incluses).                                                                      | Indien uw onderneming meerdere filialen telt, hebt u enkel de rol nodig die volstaat voor elk van die ondernemingen. Vergeet het begrip ‘mandaten'. Die zijn niet nodig als het om uw eigen onderneming (inclusief filialen) gaat.                                                            |\n| Pour plus d'info, consultez les pages suivantes :                                                                                                                                                                                                                                    | Voor meer informatie kan u de volgende websites raadplegen :                                                                                                                                                                                                                                  |\n| - quels rôles se donner : [https://www.aideacces.be/209-Roles.html](https://www.aideacces.be/209-Roles.html)                                                                                                                                                                         | - welke rol ik moet toekennen : [https://www.loginhulp.be/209-Rollen.html](https://www.loginhulp.be/209-Rollen.html)                                                                                                                                                                          |\n\nSource: Rôles_Rollen\n## Je n’arrive pas à me connecter en nom de mon entreprise - Ik kan niet inloggen in naam van mijn eigen onderneming\n\nSource: Rôles_Rollen\n| Si votre entreprise compte plusieurs filiales, vous avez juste besoin du rôle qui convient pour chacune. Oubliez la notion de mandat, ce n'est pas nécessaire pour votre propre entreprise (filiales incluses).                                                                      | Indien uw onderneming meerdere filialen telt, hebt u enkel de rol nodig die volstaat voor elk van die ondernemingen. Vergeet het begrip ‘mandaten’. Die zijn niet nodig als het om uw eigen onderneming (inclusief filialen) gaat.                                                            |\n| Pour plus d'info, consultez les pages suivantes :                                                                                                                                                                                                                                    | Voor meer informatie kan u de volgende websites raadplegen :                                                                                                                                                                                                                                  |\n| - quels rôles se donner : [https://www.aideacces.be/209-Roles.html](https://www.aideacces.be/209-Roles.html)                                                                                                                                                                         | - welke rol ik moet toekennen : [https://www.loginhulp.be/209-Rollen.html](https://www.loginhulp.be/209-Rollen.html)                                                                                                                                                                          |""]","Als een burger werkt bij een onderneming, maar niet kan inloggen in de naam van die onderneming, moet je hem adviseren om contact op te nemen met de servicedesk op 02 576 36 36. Als zij geen oplossing kunnen vinden, kan hij een ticket openen bij de dienst IAM ICT.","Indien u niet de wettelijke vertegenwoordiger van deonderneming bent, hebt u een rol nodig om in te loggen inMYMINFIN in naam van uw eigen onderneming (inclusieffilialen).
            U wilt in MYMINFIN toegang tot :
            de berichten van de onderneming, dan hebt u de rol FODFIN Berichten van de onderneming nodig;
            de documenten en formaliteiten van de onderneming, danhebt u meestal genoeg aan de rol FOD Fin Aanstelling EigenOnderneming met één of meerdere parameters in functievan uw verantwoordelijkheden (bv. Om de BTW formaliteitente beheren, hebt u de parameter ‘Aanstelling BTW' nodig).
            Indien uw onderneming meerdere filialen telt, hebt u enkel derol nodig die volstaat voor elk van die ondernemingen. Vergeethet begrip ‘mandaten'. Die zijn niet nodig als het om uw eigenonderneming (inclusief filialen) gaat.
            Voor meer informatie kan u de volgende websites raadplegen :
            welke rol ik moet toekennen : 
            Rollen
            hoe toekennen of aanvragen van een rol :
            Beheer van detoegangsaanvragen in de rollenadministratie- RMA - Loginhulp.be
            Eens dit in orde is, logt u aan op MyMinfin en identificeert uzich “in naam van een onderneming”. 
            Selecteer uw eigen onderneming (of een filiaal).",0.5,0.932468352867239,0.39109678461844205,1.0
Wat zijn de contactgegevens voor de hypoimage service?,"[""Source: Treatment_incidents\n| **Matière**                           | **Qui contacter**                                                                                                                                                                                                                                                                                                                                                                                                                                                                                                                                                                                                          |\n|---------------------------------------|----------------------------------------------------------------------------------------------------------------------------------------------------------------------------------------------------------------------------------------------------------------------------------------------------------------------------------------------------------------------------------------------------------------------------------------------------------------------------------------------------------------------------------------------------------------------------------------------------------------------------|\n| (1) Authentification                  | Contactez le **service desk** au 02 576 36 36. S'il ne trouve pas de solution, il ouvrira un ticket auprès du **service IAM ICT**.                                                                                                                                                                                                                                                                                                                                                                                                                                                                                         |\n\nSource: Treatment_incidents\n| group_baux : Contrats de location / Huurcontracten / Mietverträge <br/> group_el : Etat des lieux/ Plaatsbeschrijving / Ortsbefund | - Service : **AGDP - MYRENT**<br/>- Contacts : [dataquality.patdoc@minfin.fed.be](mailto:dataquality.patdoc@minfin.fed.be) ou **PATDOC-MyRent** (1e ligne) - [patrick.f.bottu@minfin.fed.be](mailto:patrick.f.bottu@minfin.fed.be) (ICT - service manager) - [cedric.micha@minfin.fed.be](mailto:cedric.micha@minfin.fed.be) (business - responsable service)                                       |                                                                                                                                                                                                                                                                                        |\n| group_el : Etat des lieux/ Plaatsbeschrijving / Ortsbefund                                                                         | - Service : **AGDP - HYPOIMAGE**<br/>- Contacts : [rzsj.operationeleondersteuning@minfin.fed.be](mailto:rzsj.operationeleondersteuning@minfin.fed.be) ou **PATDOC-RZSJ-Hypo** (1e ligne) - [andy.vanrompuy@minfin.fed.be](mailto:andy.vanrompuy@minfin.fed.be) (ICT - service manager ad interim) - [dirk.vanherrewegen@minfin.fed.be](mailto:dirk.vanherrewegen@minfin.fed.be) (ICT - développeur) | envoyer le mail à rzsj.operationeleondersteuning@minfin.fed.be / assigner le ticket au groupePATDOC-RZSJ-Hypo                                                                                                                                                                          |\n\nSource: Nouvelle_clé_numérique_myID.be\n**Attention :** Pour certains **clients qui utilisent le FAS de façon non standard**, des actions seront nécessaires avant la mise en production de myID.be:\n\n- Pour les clients qui ont un onboarding sur le FAS via le système direct means, nous vous invitons à prendre connaissance des informations en pièce jointe, et à réaliser les actions nécessaires afin que myID.be soit également disponible sur vos plateformes en date du 8/11/2022.\n\n- Pour les clients qui utilisent une interface personnalisée (écrans non standard du FAS), nous vous demandons de réaliser les adaptations nécessaires afin que myID.be soit également disponible sur vos plateformes en date du 8/11/2022.\n\nVous trouverez le logo myID.be aussi en annexe.\n\n> **Note importante :**\n>\n> Si vous offrez actuellement des clés numériques de niveau 'substantiel' dans le FAS pour l'accès à vos services en ligne, selon les conditions d'utilisation du FAS et de l'AR susmentionné, vous êtes obligé d'offrir également myID.be à partir du 8/11/2022.\n>\n> Nous vous remercions d'en tenir compte.\n\nDans les semaines à venir, il y aura une communication générale en concertation avec U2U Consult aux citoyens et aux médias sur myID.be dans le FAS.\n\nNous vous prions de bien vouloir partager les informations contenues dans cet e-mail avec les équipes informatiques techniques et les service desks de votre organisation.\n\nEn cas de questions ou de problèmes, nous vous invitons à revenir rapidement vers nous via servicedesk.dto@bosa.fgov.be.\n\nSource: Treatment_incidents\n## 3.2. Personnes de contact\n\nSi vous ne trouvez pas la personne ou l’adresse mail de contact dans le fichier MYMINFIN_fragments.xlsx, regardez dans\nle tableau ci-dessous. Un flag [(blauwe ster)] indique la personne ou l’adresse à privilégier. À contacter uniquement si\nla procédure au point 3.1 n’a rien donné ou pour organiser un meeting.\n\n## Structuur Contacten – ICT & Business\n\n### ️ Service Desk\n\n| **Côté ICT**                                                                                                                                                                                                     | **Côté Business**     |\n|------------------------------------------------------------------------------------------------------------------------------------------------------------------------------------------------------------------|-----------------------|\n| • Mail d'équipe : `grp-minfin-frontend@minfin.fed.be` *(enkel voor responsables)*<br>• Service Manager : **Marc Dessart**<br>• Team Manager NL : **Christophe Saelens**<br>• Team Manager FR : **Quentin Gommé** | *(geen vermeldingen)* |\n\n---\n\n### IAM\n\nSource: Treatment_incidents\n| Action / Situation              | Vérifier / Contacter                                                                                                                                                                                                                                       |\n|---------------------------------|------------------------------------------------------------------------------------------------------------------------------------------------------------------------------------------------------------------------------------------------------------|\n| Accès et attributions de rôle   | - Aller dans Mes attributions de rôle / Afficher l’aperçu de vos attributions de rôle (actuelles)                                                                                                                                                          |\n|                                 | - En prod : [https://iamapps.belgium.be/hma/generalinfo?redirectUrl=%2Fhma](https://iamapps.belgium.be/hma/generalinfo?redirectUrl=%2Fhma) (toujours se connecter avec son eid)                                                                            |\n|                                 | - Pour obtenir un accès, contacter Marc Dessart en lui envoyant le formulaire complété (FR) [demande-acces-application.docx](sharepoint.com) (NL) not found                                                                                                |\n| Question d’un avocat            | - Transférer la demande à [mandats.ict@minfin.fed.be](mailto:mandats.ict@minfin.fed.be)                                                                                                                                                                    |""]","Ik kan de contactgegevens voor de hypoimage service niet vinden in het gegeven context. Het enige wat ik vind is dat er een tabel staat met contactgegevens voor verschillende diensten, maar die van hypoimage zijn niet vermeld.","service : AGDP - HYPOIMAGE
contacts : rzsj.operationeleondersteuning@minfin.fed.be ou PATDOC-RZSJ-Hypo (1e ligne)
 - andy.vanrompuy@minfin.fed.be (ICT - servicemanager ad interim)
 - dirk.vanherrewegen@minfin.fed.be (ICT -développeur)",0.3333333333333333,0.0,0.20499400240508248,1.0
