user_input,retrieved_contexts,response,reference,faithfulness,factual_correctness(mode=f1),answer_correctness,nv_accuracy
Wie is de product owner van AGDP?,"['Document 1:\n# Contacts\n\n-\n    1. Product owners, ABA, IAM & ICT\n-\n    2. Project teams\n\n    - 2.1. Ma déclaration|Mijn aangifte\n    - 2.2. Mes paiements|Mijn betalingen\n    - 2.3. Mon habitation|Mijn woning\n    - 2.4. Mes interactions|Mijn interacties\n    - 2.5. Mes outils professionnels|Mijn professionele toepassingen\n    - 2.6. Services intranet|Intranet diensten\n    - 2.7. Mes documents\n    - 2.8. Liens utiles|Nuttige links\n\n# 1. Product owners, ABA, IAM & ICT\n\n| **Administration** | **Product owners**                                     | **ABA**                               | **IAM**                          | **ICT**                                                                                                                                               |\n|--------------------|--------------------------------------------------------|---------------------------------------|----------------------------------|-------------------------------------------------------------------------------------------------------------------------------------------------------|\n| TRANS              | Ann Van Cauwenbergh (back up: Mannuel Van Der Helst ?) |                                       |                                  |                                                                                                                                                       |\n| AGFISC             | Brigitte Brucken (back up: Emmanuel Haubruge)          | aba-gab_fisc@minfin.fed.be            | iam.fisc@minfin.fed.be           | Manager: Hang-Pascale Phan-Thanh, Staff: Luca Romano, David Crespo Garcia, Philip Kurstjens, Bupa: Helena Van Roey, Architect: Francisco Javier Calvo |\n| AGPR               | Adil Soussi Nachit                                     | aaii-agpr.myminfin@minfin.fed.be      | iam.recovery@temp.minfin.be      | Manager: Martine Smet, Staff: Jan Van Ruyskensvelde, Bupa: Michel VAN HOEGAERDEN, Architect: ![](image1.png)                                          |\n| AGPD               | Kelly Fugarino (back up: Astrid Vervoort)              | myminfin.agdp_aapd@temp.minfin.fed.be | iam.ivu-cei.patdoc@minfin.fed.be | Manager: Vincent Kamanda, Staff: Yousra Haj Haddi, Najlae El Bouenani, Regis Gasper, Bupa: Cathy EMERY, Architect: ![](image2.png)                    |\n| AGDA               | Sarah Vanobberghen                                     |                                       | iam.da@temp.minfin.be            | Manager: Julien Cohen, Bupa: Brecht Desmet / Cynthia Lonneux ad interim, Architect: ![](image3.png)                                                   |\n| AGTRES             | Christophe Martin (back up: David Vandendriessche)     |                                       | iam.thesaurie@temp.minfin.be     | Manager: Jorre Vernelen                                                                                                                               |\n| ISI                | Mohamed Boulakhrif (back up: Dirk Deroey)              | aba.bbisi@minfin.fed.be               |                                  |                                                                                                                                                       |\n| ICT                | Christophe Martin (back up: ?)                         |                                       |                                  |                                                                                                                                                       |\n| ESS                | Luc Joosten                                            |                                       |                                  |                                                                                                                                                       |\n| COMM               | Fabrice De Gregorio                                    |                                       |                                  |                                                                                                                                                       |\n\nListe des personnes de contact à informer quand il y a une nouvelle release ou un problème majeur → boîte\nmyminfin-team (à tenir à jour)\n\n![Outlook Contact List](image4.png)\n\n# 2. Project teams\n\n## 2.1. Ma déclaration|Mijn aangifte\n\nDocument 2:\n| (5) Technische problemen                 | Neem contact op met uw ABA-dienst, die zal samen met het bevoegde technische team het probleem analyseren. Indien nodig, nemen zij contact met ons.                                                                                                                                                                                                                                                                                                                                                                                                                                                      |\n| (6) Verbeteringsverzoeken                | Neem contact op met uw ABA-dienst, zij maken de analyse.                                                                                                                                                                                                                                                                                                                                                                                                                                                                                                                                                 |\n| (7) BUCA, nieuw project                  | Neem contact met uw MyMinfin Product owner: <br> - AAFISC : Brigitte Brucken en Emmanuel Haubruge <br> - ADDA : Sarah Vanobberghen <br> - AAPD : Kelly Fugarino <br> - AATHES : David Vandendriessche                                                                                                                                                                                                                                                                                                                                                                                                    |\n\nDocument 3:\n| **Id** | **Fragment**                                                                                     | **AG/AA**     | **Keywords**                                                                                                                                                        | **ICT team**                                                                                                                                                      | |\n|--------|--------------------------------------------------------------------------------------------------|---------------|---------------------------------------------------------------------------------------------------------------------------------------------------------------------|-------------------------------------------------------------------------------------------------------------------------------------------------------------------|-|\n| 001    | Site Internet du SPF Finances                                                                    |               | Website van de FOD Financiën, Webseite des FÖD Finanzen                                                                                                             |                                                                                                                                                                   | |\n| 002    | Autres e-services du SPF Finances                                                                |               | Andere e-services van de FOD Financiën, Andere E-Dienste des FÖD Finanzen                                                                                           |                                                                                                                                                                   | |\n| 003    | Registre UBO                                                                                     | AGTRES/AATHES | UBO-register, UBO-Register                                                                                                                                          | ICT - Group SNOW: TRES_GRP_CIFI, Service manager: Christophe MARTIN (back up: Vivian VACHAUDEZ), Business - Business analyst: Sébastien GUILLAUME                 | |\n| 004    | Fisconetplus banque de connaissance                                                              | ESS           | Fisconetplus kennisdatabase, Fisconetplus Wissensdatenbank                                                                                                          | ICT - Dev: Robin SANDRA (robin.sandra@realdolmen.com), Business - Group SNOW: PES-Fisconet, Project manager: Luc JOOSTEN                                          | |\n| 005    | Contact                                                                                          |               | Contact, Kontakt                                                                                                                                                    |                                                                                                                                                                   | |\n| 006    | Obligation de retenue                                                                            | AGPR/AAII     | Inhoudingsplicht, Einbehaltungspflicht                                                                                                                              | ICT - Group SNOW: IR-ICT-Team3, Service manager: Pascal CUVELIER (back up: Koen LAMOEN), Business - Group SNOW: IR-DAD-Bus, Business analyst: Gaëlle VAN DE STEEN | |\n| 007    | Formulaires (PDF)                                                                                | ICT           | Formulieren (PDF), Formulare (PDF)                                                                                                                                  | ICT - Group SNOW: TRANS-Doc&eForm, Service manager: Françoise GOFFAUX                                                                                             | |\n| 008    | Télécharger un jeu de données                                                                    | AGDP/AAPD     | Dataset downloaden, Datensatz herunterladen                                                                                                                         | ICT - Group SNOW: PATDOC-MEOW-Maps-IT, Service manager: Erik VUCHELEN, Business - Group SNOW: PATDOC-MEOW-Maps, Expert: Georges KANEZA MUNYANTORE                 | |\n\nDocument 4:\n| Pour plus d\'info, consultez les pages suivantes :                                                                                                                                                                                                                                    | Voor meer informatie kan u de volgende websites raadplegen :                                                                                                                                                                                                                                  |\n| - quels rôles se donner : [https://www.aideacces.be/209-Roles.html](https://www.aideacces.be/209-Roles.html)                                                                                                                                                                         | - welke rol ik moet toekennen : [https://www.loginhulp.be/209-Rollen.html](https://www.loginhulp.be/209-Rollen.html)                                                                                                                                                                          |\n| - donner/demander un rôle : [https://www.aideacces.be/44-Gestion_des_roles_eGov\\_\\_RMA.html](https://www.aideacces.be/44-Gestion_des_roles_eGov__RMA.html)                                                                                                                           | - hoe toekennen of aanvragen van een rol : [https://www.loginhulp.be/44-NL.html](https://www.loginhulp.be/44-NL.html)                                                                                                                                                                         |\n| Quand ceci sera fait, connectez-vous sur [www.myminfin.be](http://www.myminfin.be) et identifiez-vous ""au nom d\'une entreprise"". Sélectionnez votre propre entreprise (ou sa filiale).                                                                                               | Eens dit in orde is, logt u aan op [www.myminfin.be](http://www.myminfin.be) en identificeert u zich “in naam van een onderneming”. Selecteer uw eigen onderneming (of een filiaal).                                                                                                          |']","Volgens Document 3, Fragment 007, is de product owner voor AGDP Kelly Fugarino.",De product owner van AGDP is Kelly Fugarino,0.0,1.0,0.9865989552461171,1.0
Wie is de product owner van AGPR?,"['Document 1:\n# Contacts\n\n-\n    1. Product owners, ABA, IAM & ICT\n-\n    2. Project teams\n\n    - 2.1. Ma déclaration|Mijn aangifte\n    - 2.2. Mes paiements|Mijn betalingen\n    - 2.3. Mon habitation|Mijn woning\n    - 2.4. Mes interactions|Mijn interacties\n    - 2.5. Mes outils professionnels|Mijn professionele toepassingen\n    - 2.6. Services intranet|Intranet diensten\n    - 2.7. Mes documents\n    - 2.8. Liens utiles|Nuttige links\n\n# 1. Product owners, ABA, IAM & ICT\n\n| **Administration** | **Product owners**                                     | **ABA**                               | **IAM**                          | **ICT**                                                                                                                                               |\n|--------------------|--------------------------------------------------------|---------------------------------------|----------------------------------|-------------------------------------------------------------------------------------------------------------------------------------------------------|\n| TRANS              | Ann Van Cauwenbergh (back up: Mannuel Van Der Helst ?) |                                       |                                  |                                                                                                                                                       |\n| AGFISC             | Brigitte Brucken (back up: Emmanuel Haubruge)          | aba-gab_fisc@minfin.fed.be            | iam.fisc@minfin.fed.be           | Manager: Hang-Pascale Phan-Thanh, Staff: Luca Romano, David Crespo Garcia, Philip Kurstjens, Bupa: Helena Van Roey, Architect: Francisco Javier Calvo |\n| AGPR               | Adil Soussi Nachit                                     | aaii-agpr.myminfin@minfin.fed.be      | iam.recovery@temp.minfin.be      | Manager: Martine Smet, Staff: Jan Van Ruyskensvelde, Bupa: Michel VAN HOEGAERDEN, Architect: ![](image1.png)                                          |\n| AGPD               | Kelly Fugarino (back up: Astrid Vervoort)              | myminfin.agdp_aapd@temp.minfin.fed.be | iam.ivu-cei.patdoc@minfin.fed.be | Manager: Vincent Kamanda, Staff: Yousra Haj Haddi, Najlae El Bouenani, Regis Gasper, Bupa: Cathy EMERY, Architect: ![](image2.png)                    |\n| AGDA               | Sarah Vanobberghen                                     |                                       | iam.da@temp.minfin.be            | Manager: Julien Cohen, Bupa: Brecht Desmet / Cynthia Lonneux ad interim, Architect: ![](image3.png)                                                   |\n| AGTRES             | Christophe Martin (back up: David Vandendriessche)     |                                       | iam.thesaurie@temp.minfin.be     | Manager: Jorre Vernelen                                                                                                                               |\n| ISI                | Mohamed Boulakhrif (back up: Dirk Deroey)              | aba.bbisi@minfin.fed.be               |                                  |                                                                                                                                                       |\n| ICT                | Christophe Martin (back up: ?)                         |                                       |                                  |                                                                                                                                                       |\n| ESS                | Luc Joosten                                            |                                       |                                  |                                                                                                                                                       |\n| COMM               | Fabrice De Gregorio                                    |                                       |                                  |                                                                                                                                                       |\n\nListe des personnes de contact à informer quand il y a une nouvelle release ou un problème majeur → boîte\nmyminfin-team (à tenir à jour)\n\n![Outlook Contact List](image4.png)\n\n# 2. Project teams\n\n## 2.1. Ma déclaration|Mijn aangifte\n\nDocument 2:\n| (5) Technische problemen                 | Neem contact op met uw ABA-dienst, die zal samen met het bevoegde technische team het probleem analyseren. Indien nodig, nemen zij contact met ons.                                                                                                                                                                                                                                                                                                                                                                                                                                                      |\n| (6) Verbeteringsverzoeken                | Neem contact op met uw ABA-dienst, zij maken de analyse.                                                                                                                                                                                                                                                                                                                                                                                                                                                                                                                                                 |\n| (7) BUCA, nieuw project                  | Neem contact met uw MyMinfin Product owner: <br> - AAFISC : Brigitte Brucken en Emmanuel Haubruge <br> - ADDA : Sarah Vanobberghen <br> - AAPD : Kelly Fugarino <br> - AATHES : David Vandendriessche                                                                                                                                                                                                                                                                                                                                                                                                    |\n\nDocument 3:\n| Pour plus d\'info, consultez les pages suivantes :                                                                                                                                                                                                                                    | Voor meer informatie kan u de volgende websites raadplegen :                                                                                                                                                                                                                                  |\n| - quels rôles se donner : [https://www.aideacces.be/209-Roles.html](https://www.aideacces.be/209-Roles.html)                                                                                                                                                                         | - welke rol ik moet toekennen : [https://www.loginhulp.be/209-Rollen.html](https://www.loginhulp.be/209-Rollen.html)                                                                                                                                                                          |\n| - donner/demander un rôle : [https://www.aideacces.be/44-Gestion_des_roles_eGov\\_\\_RMA.html](https://www.aideacces.be/44-Gestion_des_roles_eGov__RMA.html)                                                                                                                           | - hoe toekennen of aanvragen van een rol : [https://www.loginhulp.be/44-NL.html](https://www.loginhulp.be/44-NL.html)                                                                                                                                                                         |\n| Quand ceci sera fait, connectez-vous sur [www.myminfin.be](http://www.myminfin.be) et identifiez-vous ""au nom d\'une entreprise"". Sélectionnez votre propre entreprise (ou sa filiale).                                                                                               | Eens dit in orde is, logt u aan op [www.myminfin.be](http://www.myminfin.be) en identificeert u zich “in naam van een onderneming”. Selecteer uw eigen onderneming (of een filiaal).                                                                                                          |\n\nDocument 4:\n| Pour plus d\'info, consultez les pages suivantes :                                                                                                                                                                                                                                    | Voor meer informatie kan u de volgende websites raadplegen :                                                                                                                                                                                                                                  |\n| - quels rôles se donner : [https://www.aideacces.be/209-Roles.html](https://www.aideacces.be/209-Roles.html)                                                                                                                                                                         | - welke rol ik moet toekennen : [https://www.loginhulp.be/209-Rollen.html](https://www.loginhulp.be/209-Rollen.html)                                                                                                                                                                          |\n| - donner/demander un rôle : [https://www.aideacces.be/44-Gestion_des_roles_eGov\\_\\_RMA.html](https://www.aideacces.be/44-Gestion_des_roles_eGov__RMA.html)                                                                                                                           | - hoe toekennen of aanvragen van een rol : [https://www.loginhulp.be/44-NL.html](https://www.loginhulp.be/44-NL.html)                                                                                                                                                                         |\n| Quand ceci sera fait, connectez-vous sur [www.myminfin.be](http://www.myminfin.be) et identifiez-vous ""au nom d\'une entreprise"". Sélectionnez votre propre entreprise (ou sa filiale).                                                                                               | Eens dit in orde is, logt u aan op [www.myminfin.be](http://www.myminfin.be) en identificeert u zich “in naam van een onderneming”. Selecteer uw eigen onderneming (of een filiaal).                                                                                                          |']",De product owner van AGPR is Adil Soussi Nachit.,De product owner van AGPR is Adil Soussi Nachit,1.0,1.0,0.9969690172573566,1.0
