user_input,retrieved_contexts,response,reference,faithfulness,answer_relevancy,answer_correctness,context_recall
Wie is de product owner van AGPD?,"[""Source: Rôles_Rollen\n### L'utilisateur agit pour un client\n\nSource: Treatment_incidents\n| (5) Problème technique                | Contactez votre **service ABA** qui analysera le problème avec l'**équipe technique compétente** et nous contactera si nécessaire.                                                                                                                                                                                                                                                                                                                                                                                                                                                                                         |\n| (6) Demande d'amélioration            | Contactez **votre service ABA** qui analysera la situation.                                                                                                                                                                                                                                                                                                                                                                                                                                                                                                                                                                |\n| (7) BUCA, nouveau projet              | Contactez **votre product owner MYMINFIN** : <br> - AGFISC : Brigitte Brucken et Emmanuel Haubruge <br> - AGDA : Sarah Vanobberghen <br> - AGDP : Kelly Fugarino <br> - AGTRES : David Vandendriessche                                                                                                                                                                                                                                                                                                                                                                                                                     |\n\nSource: Contacts\n| **Id**      | **Fragment**                                              | **AG/AA**     | **Keywords**                                                                                                                                                                             | **Project team**                                                                                                                                                                                                                                                       | **MMF**          |\n|-------------|-----------------------------------------------------------|---------------|------------------------------------------------------------------------------------------------------------------------------------------------------------------------------------------|------------------------------------------------------------------------------------------------------------------------------------------------------------------------------------------------------------------------------------------------------------------------|------------------|\n| 001         | Ma déclaration / Ma proposition de déclaration simplifiée | AGFISC/AAFISC | DeclarationStatusRest, IPP, INR, TOW, TaxOnWeb, Taxi, Dad, bulle, déclaration/aangifte, déclaration simplifiée/vereenvoudigde aangifte, PDS, avertissement extrait de rôle/aanslagbiljet | **BULLE 1 (TOW)**: ICT - Service Manager: Hans DE VLIEGER, Business - Group SNOW: FISC-PB, Business analyst: Sophie GULZAR                                                                                                                                             |                  |\n\nSource: Rôles_Rollen\n### L'utilisateur agit au nom de sa propre entreprise\n\nSource: Contacts\n| **Administration** | **Product owners**                                     | **ABA**                               | **IAM**                          | **ICT**                                                                                                                                               |\n|--------------------|--------------------------------------------------------|---------------------------------------|----------------------------------|-------------------------------------------------------------------------------------------------------------------------------------------------------|\n| TRANS              | Ann Van Cauwenbergh (back up: Mannuel Van Der Helst ?) |                                       |                                  |                                                                                                                                                       |\n| AGFISC             | Brigitte Brucken (back up: Emmanuel Haubruge)          | aba-gab_fisc@minfin.fed.be            | iam.fisc@minfin.fed.be           | Manager: Hang-Pascale Phan-Thanh, Staff: Luca Romano, David Crespo Garcia, Philip Kurstjens, Bupa: Helena Van Roey, Architect: Francisco Javier Calvo |\n| AGPR               | Adil Soussi Nachit                                     | aaii-agpr.myminfin@minfin.fed.be      | iam.recovery@temp.minfin.be      | Manager: Martine Smet, Staff: Jan Van Ruyskensvelde, Bupa: Michel VAN HOEGAERDEN, Architect: ![](image1.png)                                          |\n| AGPD               | Kelly Fugarino (back up: Astrid Vervoort)              | myminfin.agdp_aapd@temp.minfin.fed.be | iam.ivu-cei.patdoc@minfin.fed.be | Manager: Vincent Kamanda, Staff: Yousra Haj Haddi, Najlae El Bouenani, Regis Gasper, Bupa: Cathy EMERY, Architect: ![](image2.png)                    |""]",Het product owner van AGPD is Kelly Fugarino.,De product owner van AGPD is Kelly Fugarino en je kan haar contacteren via myminfin.agdp_aapd@temp.minfin.be,1.0,0.9341241132617187,0.7365086170973381,1.0
Wie is de product owner van AGPR en kan je de contactgegevens geven?,"['Source: Contacts\n# Contacts\n\n1. Product owners, ABA, IAM & ICT\n2. Project teams\n\n    - 2.1. Ma déclaration|Mijn aangifte\n    - 2.2. Mes paiements|Mijn betalingen\n    - 2.3. Mon habitation|Mijn woning\n    - 2.4. Mes interactions|Mijn interacties\n    - 2.5. Mes outils professionnels|Mijn professionele toepassingen\n    - 2.6. Services intranet|Intranet diensten\n    - 2.7. Mes documents\n    - 2.8. Liens utiles|Nuttige links\n\n# 1. Product owners, ABA, IAM & ICT\n\nSource: Treatment_incidents\n| group_baux : Contrats de location / Huurcontracten / Mietverträge <br/> group_el : Etat des lieux/ Plaatsbeschrijving / Ortsbefund | - Service : **AGDP - MYRENT**<br/>- Contacts : [dataquality.patdoc@minfin.fed.be](mailto:dataquality.patdoc@minfin.fed.be) ou **PATDOC-MyRent** (1e ligne) - [patrick.f.bottu@minfin.fed.be](mailto:patrick.f.bottu@minfin.fed.be) (ICT - service manager) - [cedric.micha@minfin.fed.be](mailto:cedric.micha@minfin.fed.be) (business - responsable service)                                       |                                                                                                                                                                                                                                                                                        |\n| group_el : Etat des lieux/ Plaatsbeschrijving / Ortsbefund                                                                         | - Service : **AGDP - HYPOIMAGE**<br/>- Contacts : [rzsj.operationeleondersteuning@minfin.fed.be](mailto:rzsj.operationeleondersteuning@minfin.fed.be) ou **PATDOC-RZSJ-Hypo** (1e ligne) - [andy.vanrompuy@minfin.fed.be](mailto:andy.vanrompuy@minfin.fed.be) (ICT - service manager ad interim) - [dirk.vanherrewegen@minfin.fed.be](mailto:dirk.vanherrewegen@minfin.fed.be) (ICT - développeur) | envoyer le mail à rzsj.operationeleondersteuning@minfin.fed.be / assigner le ticket au groupePATDOC-RZSJ-Hypo                                                                                                                                                                          |\n\nSource: Rôles_Rollen\n| - donner/demander un rôle : [https://www.aideacces.be/44-Gestion_des_roles_eGov__RMA.html](https://www.aideacces.be/44-Gestion_des_roles_eGov__RMA.html)                                                                                                                             | - hoe toekennen of aanvragen van een rol : [https://www.loginhulp.be/44-NL.html](https://www.loginhulp.be/44-NL.html)                                                                                                                                                                         |\n| Quand ceci sera fait, connectez-vous sur [www.myminfin.be](http://www.myminfin.be) et identifiez-vous ""au nom d\'une entreprise"". Sélectionnez votre propre entreprise (ou sa filiale).                                                                                               | Eens dit in orde is, logt u aan op [www.myminfin.be](http://www.myminfin.be) en identificeert u zich “in naam van een onderneming”. Selecteer uw eigen onderneming (of een filiaal).                                                                                                          |\n\nSource: Rôles_Rollen\n| - donner/demander un rôle : [https://www.aideacces.be/44-Gestion_des_roles_eGov__RMA.html](https://www.aideacces.be/44-Gestion_des_roles_eGov__RMA.html)                                                                                                                             | - hoe toekennen of aanvragen van een rol : [https://www.loginhulp.be/44-NL.html](https://www.loginhulp.be/44-NL.html)                                                                                                                                                                         |\n| Quand ceci sera fait, connectez-vous sur [www.myminfin.be](http://www.myminfin.be) et identifiez-vous ""au nom d\'une entreprise"". Sélectionnez votre propre entreprise (ou sa filiale).                                                                                               | Eens dit in orde is, logt u aan op [www.myminfin.be](http://www.myminfin.be) en identificeert u zich “in naam van een onderneming”. Selecteer uw eigen onderneming (of een filiaal).                                                                                                          |\n                                                                                                          |\n\nSource: Treatment_incidents\n| (5) Technische problemen                 | Neem contact op met uw ABA-dienst, die zal samen met het bevoegde technische team het probleem analyseren. Indien nodig, nemen zij contact met ons.                                                                                                                                                                                                                                                                                                                                                                                                                                                      |\n| (6) Verbeteringsverzoeken                | Neem contact op met uw ABA-dienst, zij maken de analyse.                                                                                                                                                                                                                                                                                                                                                                                                                                                                                                                                                 |\n| (7) BUCA, nieuw project                  | Neem contact met uw MyMinfin Product owner: <br> - AAFISC : Brigitte Brucken en Emmanuel Haubruge <br> - ADDA : Sarah Vanobberghen <br> - AAPD : Kelly Fugarino <br> - AATHES : David Vandendriessche                                                                                                                                                                                                                                                                                                                                                                                                    |']","Het spijt me, maar ik heb niet genoeg informatie om de product owner van AGPR te identificeren en hun contactgegevens te geven.

De context vertelt ons dat er verschillende product owners zijn voor verschillende diensten, zoals AAFISC, ADDA, AAPD en AATHES. Het spijt me dat ik niet kan helpen om de specifieke product owner van AGPR te identificeren en hun contactgegevens te geven.

Ik kan echter wel aanbevelen om de contactgegevens van de product owners voor andere diensten te controleren, zoals AAFISC, ADDA, AAPD en AATHES, die in de context worden genoemd.",De product owner van AGPR is Adil Soussi Nachit en je kan hem contacteren via aaii-agpr.myminfin@minfin.fed.be,1.0,0.0,0.22179839665201329,0.0
"Kan je me alle contactgegevens geven voor het fragment UBO-register, ook de SNOW groep.","['Source: Contacts\n| **Application**                                    | **Contact**                                                                                                                                                                                                                                                                                                                           | **Procédure**                                                                   | **SNOW group**                                   |\n|----------------------------------------------------|---------------------------------------------------------------------------------------------------------------------------------------------------------------------------------------------------------------------------------------------------------------------------------------------------------------------------------------|---------------------------------------------------------------------------------|--------------------------------------------------|\n| **Communes - MES OUTILS PROFESSIONNELS**           | Informations du SPF Finances pour les Communes - MIJN PROFESSIONELE TOEPASSINGEN                                                                                                                                                                                                                                                      | Informatie van de FOD Financiën voor de gemeenten - [MES OUTILS PROFESSIONNELS] | Informationen des FÖD Finanzen für die Gemeinden | **Business**: Adil Soussi Nachit, Martine Smet, L\'utilisateur doit d\'office être redirigé vers staff.recovery@minfin.fed.be | |\n\nSource: Treatment_incidents\n| **1. Authentification**                  | **1ère ligne : Service Desk**  <br>• Ticket SNOW : *n/a*  <br>• Groupe SNOW : **SERVICEDESK**  <br>• Mail : *n/a*  <br>• 📞 Téléphone : 02 576 36 36  <br><br>**2ème ligne : IAM ICT**  <br>• Ticket SNOW : **Ticket PROD / Ticket ACC**  <br>• Groupe SNOW : **TRANS-IAM**  <br>• Mail : *n/a*                                                                                                                                                                                                                                                                                                                                                                                                                                                                                                                                                                                                                                                                                                                                                                                                                                                                                                                                                                                                                                                                                                                                                                                                                                                                                                                |\n\nSource: Contacts\n| 005    | Contact                                                                                          |               | Contact, Kontakt                                                                                                                                                    |                                                                                                                                                                   | |\n| 006    | Obligation de retenue                                                                            | AGPR/AAII     | Inhoudingsplicht, Einbehaltungspflicht                                                                                                                              | ICT - Group SNOW: IR-ICT-Team3, Service manager: Pascal CUVELIER (back up: Koen LAMOEN), Business - Group SNOW: IR-DAD-Bus, Business analyst: Gaëlle VAN DE STEEN | |\n| 007    | Formulaires (PDF)                                                                                | ICT           | Formulieren (PDF), Formulare (PDF)                                                                                                                                  | ICT - Group SNOW: TRANS-Doc&eForm, Service manager: Françoise GOFFAUX                                                                                             | |\n| 008    | Télécharger un jeu de données                                                                    | AGDP/AAPD     | Dataset downloaden, Datensatz herunterladen                                                                                                                         | ICT - Group SNOW: PATDOC-MEOW-Maps-IT, Service manager: Erik VUCHELEN, Business - Group SNOW: PATDOC-MEOW-Maps, Expert: Georges KANEZA MUNYANTORE                 | |\n\nSource: Treatment_incidents\n| **3. Fuite de données (""databreach"")**   | **Pour un databreach : IAM PRIVACY Business**  <br>• AG inconnue :  <br>\u2003\u2003• Ticket SNOW : *n/a*  <br>\u2003\u2003• Groupe SNOW : **IAM-VP**  <br>• AGFISC :  <br>\u2003\u2003• Ticket SNOW : *n/a*  <br>\u2003\u2003• Groupe SNOW : **Contact-Privacy-FISC**  <br>• AGPR / AGDP / AGDA / AGTRES :  <br>\u2003\u2003• Groupe SNOW : **Contact-Privacy-PATDOC**  <br>• AGPR (Patdoc) mail : Privacy.ivu-cei.patdoc@minfin.fed.be                                                                                                                                                                                                                                                                                                                                                                                                                                                                                                                                                                                                                                                                                                                                                                                                                                                                                                                                                                                                                                                                                                                                                                                                                         |\n\nSource: Contacts\n| 004    | Consulter mes actes                       | AGDP/AAPD | group_hypoimage, acte notarié/notariële akte                                                | ICT - Group SNOW: PATDOC-RZSJHypo, Service manager: Andy VAN ROMPUY, Dev: Rudi PAHAUX                                                                                                                                                                          | CH, Back-up: EB  |\n| 005    | Demander une identification préalable     | AGDP/AAPD | PrecadRest, PrecadGeometer, précadastration/precadastratie                                  | ICT - Group SNOW: PATDOC-MEOW-VIP-IT, Service manager: Erik VUCHELEN, Technical analyst: Koen MEKERS, Dev: Damien KECH, Tester: David BOTHA, Business - Business analyst: Kim DEVRIESE, Support: support.meow@minfin.fed.be, Contact list Outlook: AGDP_PRECAD | CH, Back-up: OVB |\n| 006    | Commander des données patrimoniales       | AGDP/AAPD | CdmshopRest, données patrimoniales/patrimoniumgegevens                                      | ICT - Group SNOW: PATDOC-OutputServices, Service manager: José CHICO MARTINEZ, Devs: Julien BASTIN, Corenthin DUBOIS, Business - Expert: Robin DE MEYER, Support: datadelivery@minfin.fed.be                                                                   | EB, Back-up: CH  |\n| 007    | Demander des informations cadastrales     | AGDP/AAPD | CadInfoRest, POW (property on web) light                                                    | ICT - Group SNOW: PATDOC-OutputServices, Service manager: José CHICO MARTINEZ, Business - Expert: Robin DE MEYER, Support: datadelivery@minfin.fed.be                                                                                                          | EB, Back-up: OVB |']","Ik heb genoeg informatie om je te helpen bij je vraag. Volgens de context zijn de contactgegevens voor het fragment UBO-register en de SNOW groep als volgt:

* De SNOW groep is **SERVICEDESK**.
* De contactpersoon voor het fragment UBO-register is Adil Soussi Nachit, Martine Smet en de gebruiker moet d'office worden gericht naar staff.recovery@minfin.fed.be.

Ik heb geen meer informatie over andere contactgegevens voor het fragment UBO-register of de SNOW groep.","Fragment: UBO-register – Contactgegevens
- ICT
  - Group SNOW: TRES_GRP_CIFI
  - Service manager: Christophe MARTIN (back-up: Vivian VACHAUDEZ)
- Business
  - Business analyst: Sébastien GUILLAUME",0.5,0.0,0.6395737229914217,0.5
Hoe of waar moet ik mijn tijd loggen voor de support?,"['Source: Rôles_Rollen\n## Je n’arrive pas à me connecter en nom de mon entreprise - Ik kan niet inloggen in naam van mijn eigen onderneming\n\nSource: Treatment_incidents\n# 11. Mon profil | Mijn profiel | Mein Profil\n\n| **Fonctionnalité**                                                                | **Backend**                                                                                                                                                                                                                                                                |\n|-----------------------------------------------------------------------------------|----------------------------------------------------------------------------------------------------------------------------------------------------------------------------------------------------------------------------------------------------------------------------|\n| **bank-account** <br/>- Numéro de compte<br/>- Rekeningnummer<br/>- Accountnummer | - Service : **SITRAN / MYBICBAN**<br/>- Contacts : [grp-minfin-sitranict](mailto:grp-minfin-sitranict) (ICT - équipe dev Sitran) - Alain Deweweire (ICT - Service Manager Sitran) - Brecht Desmet (ICT Service Manager MyBicBan) - sitran (business - gestion des données) |\n\n# 12. Liens Utiles | Nuttige Links | Nützliche Links\n\nSource: Rôles_Rollen\n| MYMINFIN ne stocke aucune donnée. Si le processus ne permet pas d\'annuler une demande, l\'utilisateur doit contacter le service qui a reçu le document.                                                                                                               | MYMINFIN slaat geen gegevens op. Als het proces niet toelaat om te annuleren, moet de gebruiker contact opnemen met de afdeling die het document heeft ontvangen.                                                                                                                |\n| J\'imagine que cela a été fait via ""Répondre à une lettre"" - dans ce cas, le client doit vous communiquer le code à trois chiffres qu\'il a utilisé et vous devez transmettre le ticket à l\'équipe SOH qui pourra vous dire quel est le service compétent à contacter. | Ik vermoed dat dit document is verstuurd via ""Antwoord op een brief"" - in dit geval moet de klant de gebruikte driecijferige code meedelen en moet je het ticket doorsturen naar het SOH-team. Die kunnen je vertellen met welke bevoegde service contact moet worden opgenomen. |\n| Nous ne pouvons donc pas vous aider pour ce cas.                                                                                                                                                                                                                     | Wij kunnen u niet helpen.                                                                                                                                                                                                                                                        |\n\nSource: Rôles_Rollen\n| Voici les textes info à envoyer aux personnes qui ne savent pas comment se donner un rôle / signer un mandat (et je les avais déjà envoyés à votre équipe). Si par contre la question porte sur le rôle à avoir pour accéder à telle fonctionnalité ou à tel document, alors c\'est bien pour IAM, mais alors votre agent doit demander quel rôle il faut au lieu de transférer le mail pour qu\'IAM réponde à sa place car aucune équipe de 2e ligne ne répondra directement au client. | Hier zijn de teksten om te sturen naar mensen die niet weten hoe ze zichzelf een rol moeten geven / een mandaat moeten ondertekenen (deze werden al naar je team gestuurd). Als de vraag gaat over de rol die je moet hebben om toegang te krijgen tot een functie of een document, dan is deze voor IAM. Je agent zal moeten vragen welke rol hij heeft om deze door te sturen naar IAM. Tweedelijnsteams mogen niet direct reageren op de klant. |\n\nSource: Treatment_incidents\n**NL**\n\nBeste collega,\n\nWij verzoeken u om voor uw verzoek het bevoegde team te raadplegen en niet langer rechtstreeks contact met ons op te\nnemen.']","Het spijt me, maar ik heb genoeg informatie om een duidelijke antwoord te geven. Volgens de context in het document ""Rôles_Rollen"" moet je tijd loggen voor de support als:

* Je niet kunt inloggen in naam van jouw eigen onderneming (bron: Treatment_incidents #11)
* Je niet weet hoe je jezelf een rol moet geven / een mandaat moet ondertekenen (bron: Rôles_Rollen #12)

In beide gevallen wordt aangeraden om contact op te nemen met het bevoegde team en niet rechtstreeks contact op te nemen met de support.","Where to log support time (from most preferred to least preferred):
    
        1. Related ticket
           - Project: MYMINFIN
           - Log time to an existing issue whenever possible.
    
        2. New bug
           - Project: MYMINFIN
           - If the reported problem requires creating a bug issue, log your time in an “analysis” subtask.
    
        3. Business Support
           - Fisc: [MYMINFIN-9958] [support] MYMINFIN 3rd line AGFISC/AAFISC - JIRA Cloud – ACTIVE
           - Rec: MYMINFIN-12102: Recouvrement Support – ACTIVE
           - Patdoc: MYMINFIN-12104: PatDoc Support – ACTIVE
           - Douane: MYMINFIN-12106: Douane Support – ACTIVE
           - Trésorerie: MYMINFIN-12108: Trésorerie Support – ACTIVE
           - (Until end of August, except FISC)
    
        4. Transversal Support (last resort if none of the above applies)
           - Transversal: MYMINFIN-12182: Transversal Support – ACTIVE
           - ICT: MYMINFIN-12110: Support Day – ACTIVE
           - (Until end of August)",0.2857142857142857,0.0,0.1922236251612193,0.8333333333333334
Een gebruiker heeft geen toegang tot een functionaliteit wat moet ik hiermee doen,"['Source: Treatment_incidents\n| **Onderwerp**                            | **Wie contacteren**                                                                                                                                                                                                                                                                                                                                                                                                                                                                                                                                                                                      |\n|------------------------------------------|----------------------------------------------------------------------------------------------------------------------------------------------------------------------------------------------------------------------------------------------------------------------------------------------------------------------------------------------------------------------------------------------------------------------------------------------------------------------------------------------------------------------------------------------------------------------------------------------------------|\n| (1) Authenticatie                        | Neem contact op met de **servicedesk** op 02 576 36 36. Als zij geen oplossing kunnen vinden, kan je een ticket openen bij de dienst **IAM ICT**.                                                                                                                                                                                                                                                                                                                                                                                                                                                        |\n\nSource: Treatment_incidents\n# 11. Mon profil | Mijn profiel | Mein Profil\n\n| **Fonctionnalité**                                                                | **Backend**                                                                                                                                                                                                                                                                |\n|-----------------------------------------------------------------------------------|----------------------------------------------------------------------------------------------------------------------------------------------------------------------------------------------------------------------------------------------------------------------------|\n| **bank-account** <br/>- Numéro de compte<br/>- Rekeningnummer<br/>- Accountnummer | - Service : **SITRAN / MYBICBAN**<br/>- Contacts : [grp-minfin-sitranict](mailto:grp-minfin-sitranict) (ICT - équipe dev Sitran) - Alain Deweweire (ICT - Service Manager Sitran) - Brecht Desmet (ICT Service Manager MyBicBan) - sitran (business - gestion des données) |\n\n# 12. Liens Utiles | Nuttige Links | Nützliche Links\n\nSource: Rôles_Rollen\n## Je n’arrive pas à me connecter en nom de mon entreprise - Ik kan niet inloggen in naam van mijn eigen onderneming\n\nSource: Contacts\n## 2.5. Mes outils professionnels|Mijn professionele toepassingen\n\nSource: Treatment_incidents\n| (2) Toegangsrechten (rollen en mandaten) | Controleer bij de gebruiker wat zijn egov-rollen zijn voor zijn bedrijf. Als de gebruiker mandataris is, controleer je welke mandaten hij heeft ondertekend met zijn klant. Controleer vervolgens of deze rol of mandaat hem toegang geeft tot het document (via de tool om de toegangsrechten te controleren) of tot de functionaliteit voor zijn bedrijf of klant (als u de informatie niet kan vinden op de site van de FOD Financiën, meld dit aan uw communicatieteam). Als de gebruiker de juiste rol en machtiging heeft, maar geen toegang, dan moet u het ticket doorsturen naar uw IAM dienst. |\n| (3) Datalek (""databreach"")               | De gebruiker moet een klacht indienen via de website van de FOD Financiën, deze worden automatisch doorgestuurd naar de bevoegde afdeling IAM Security.                                                                                                                                                                                                                                                                                                                                                                                                                                                  |\n| (4) Datakwaliteit                        | Neem contact op met de verantwoordelijke afdeling. Als deze dienst onregelmatigheden vaststelt tussen de gegevens in de bronapplicatie en de zichtbare gegevens in MyMinFin, dan zal die het ticket bezorgen aan zijn ABA-dienst.                                                                                                                                                                                                                                                                                                                                                                        |']","Het spijt me dat ik niet genoeg informatie heb om een duidelijke aanpak te geven voor het geval dat een gebruiker geen toegang heeft tot een functionaliteit. De context geeft aan welke functionaliteiten er beschikbaar zijn en wie je kunt contacteren wanneer er problemen zijn, maar het geeft niet direct aan hoe je moet handelen als de gebruiker geen toegang heeft.

Ik kan je aanraden om de volgende stappen te nemen:

1. Controleer of de gebruiker de juiste rol en machtiging heeft voor de functionaliteit waar hij geen toegang heeft.
2. Controleer of er een klacht of een issue is geregistreerd bij de FOD Financiën of de dienst IAM ICT.
3. Neem contact op met de verantwoordelijke afdeling of de ABA-dienst om te controleren of er enige problemen zijn met de gegevens of de functionaliteit.

Ik hoop dat deze aanraden je helpen om het probleem op te lossen. Als je nog meer informatie nodig hebt, neem dan contact op met de dienst IAM ICT of de FOD Financiën.","Vragen met betrekking tot toegangsrechten moeten voortaan worden doorgestuurd naar de algemene mailboxen van de IAM-cellen.
Let op: deze adressen MOGEN NIET aan klanten worden meegedeeld.

Fiscaliteit: support-egov.agfisc@minfin.fed.be

Invordering & Innen: support-egov.agpr@minfin.fed.be

Patrimoniumdocumentatie: support-egov.agdp@minfin.fed.be

Douane & Accijnzen: support-egov.da@minfin.fed.be

Thesaurie: support-egov.thesaurie@minfin.fed.be

Algemeen: support-egov@minfin.fed.be",0.3333333333333333,0.0,0.21054705457239498,0.125
"Er is een probleem met attest service, wie kan ik hiervoor contacteren?","[""Source: Treatment_incidents\n| **attest-service** | - Service : Transversal<br>- Contacts : [grp-minfin-finattest-devteam@minfin.fed.be](mailto:grp-minfin-finattest-devteam@minfin.fed.be) (ICT - dev team - à contacter en priorité pour les problèmes techniques) - [serge.alexandre](mailto:serge.alexandre) (ICT - Service Manager) - [faycal.serraj](mailto:faycal.serraj) (ICT - dev) - [sebastien.ledent](mailto:sebastien.ledent) / [inge.jennen](mailto:inge.jennen) (business - chefs de projet)<br>- Mes demandes d'attestations<br>- Mijn aanvragen van attesten<br>- Meine Anträge auf Bescheinigung |\n\nSource: Treatment_incidents\n| Utilisateur             | Vérifier / Contacter                                                                                                                                                                                                                                                                                                                                                                                                                                                                                                                               |\n|-------------------------|----------------------------------------------------------------------------------------------------------------------------------------------------------------------------------------------------------------------------------------------------------------------------------------------------------------------------------------------------------------------------------------------------------------------------------------------------------------------------------------------------------------------------------------------------|\n| **Utilisateur interne** | Soit l’utilisateur n’a aucun rôle / pas le rôle requis pour accéder à la fonctionnalité ou au document dans MYMINFIN, soit il ne s’est pas connecté correctement (certaines fonctionnalités peuvent exiger une authentification par eID) → dans les deux cas, il faut transférer sa demande à la cellule IAM compétente (s’il s’agit d’un mail : adresses mail des cellules IAM / s’il s’agit d’un ticket snow : assignment group IAM-*) pour vérifier les rôles avant toute autre recherche.                                                      |\n\nSource: Treatment_incidents\n| Action / Situation              | Vérifier / Contacter                                                                                                                                                                                                                                       |\n|---------------------------------|------------------------------------------------------------------------------------------------------------------------------------------------------------------------------------------------------------------------------------------------------------|\n| Accès et attributions de rôle   | - Aller dans Mes attributions de rôle / Afficher l’aperçu de vos attributions de rôle (actuelles)                                                                                                                                                          |\n|                                 | - En prod : [https://iamapps.belgium.be/hma/generalinfo?redirectUrl=%2Fhma](https://iamapps.belgium.be/hma/generalinfo?redirectUrl=%2Fhma) (toujours se connecter avec son eid)                                                                            |\n|                                 | - Pour obtenir un accès, contacter Marc Dessart en lui envoyant le formulaire complété (FR) [demande-acces-application.docx](sharepoint.com) (NL) not found                                                                                                |\n| Question d’un avocat            | - Transférer la demande à [mandats.ict@minfin.fed.be](mailto:mandats.ict@minfin.fed.be)                                                                                                                                                                    |\n\nSource: Treatment_incidents\n| **Matière**                           | **Qui contacter**                                                                                                                                                                                                                                                                                                                                                                                                                                                                                                                                                                                                          |\n|---------------------------------------|----------------------------------------------------------------------------------------------------------------------------------------------------------------------------------------------------------------------------------------------------------------------------------------------------------------------------------------------------------------------------------------------------------------------------------------------------------------------------------------------------------------------------------------------------------------------------------------------------------------------------|\n| (1) Authentification                  | Contactez le **service desk** au 02 576 36 36. S'il ne trouve pas de solution, il ouvrira un ticket auprès du **service IAM ICT**.                                                                                                                                                                                                                                                                                                                                                                                                                                                                                         |\n\nSource: Contacts\n| 001_04 | Demander une attestation de non-propriété |           | URBAIN prodocs, non-propriété/niet eigendom                                                 | ICT → MyMinfin team                                                                                                                                                                                                                                            | CH, Back-up: OVB |\n| 002    | Consulter mes baux de location            | AGDP/AAPD | MyrentRest, contrat de bail/huurcontract, état des lieux/plaatsbeschrijving                 | ICT - Group SNOW: PATDOC-MyRent, Service manager: Patrick BOTTU, Devs: Florent DEFOUR, Aymeric VERMOUT, Business - Business analyst: Cédric MICHA                                                                                                              | CH, Back-up: EB  |\n| 003    | Demander un extrait cadastral             | AGDP/AAPD | CadexRest, extraits cadastraux/kadastrale uittreksels                                       | ICT - Group SNOW: PATDOC-OutputServices, Service manager: José CHICO MARTINEZ, Business - Business analyst: Shahzad RAHMAN, Support: (1st line) ceivu.support.extracts@minfin.fed.be (2nd line) datadelivery@minfin.fed.be                                     | EB, Back-up: OVB |\n| 004    | Consulter mes actes                       | AGDP/AAPD | group_hypoimage, acte notarié/notariële akte                                                | ICT - Group SNOW: PATDOC-RZSJHypo, Service manager: Andy VAN ROMPUY, Dev: Rudi PAHAUX                                                                                                                                                                          | CH, Back-up: EB  |""]","Ik heb genoeg informatie om je te helpen bij het vinden van de juiste contactpersoon voor het attest service-probleem.

Volgens de Treatment_incidentsbron kun je contact opnemen met de volgende personen en teams:

* De ICT-ontwikkelingsteam: [grp-minfin-finattest-devteam@minfin.fed.be](mailto:grp-minfin-finattest-devteam@minfin.fed.be)
* De Service Manager ICT: Serge Alexandre ([serge.alexandre](mailto:serge.alexandre))
* De ICT-ontwikkelingsmedewerker Faycal Serraj ([faycal.serraj](mailto:faycal.serraj))
* De ICT-ontwikkelingsmedewerker Sebastien Ledent ([sebastien.ledent](mailto:sebastien.ledent)) en Inge Jennen ([inge.jennen](mailto:inge.jennen))

Je kunt ook contact opnemen met de service desk bij 02 576 36 36, die je zal doorsturen naar het Service IAM ICT als ze niet kunnen helpen.

Ik hoop dat dit helpt!",Je kan contact ponemen met het development team via grp-minfin-finattest-devteam@minfin.fed.be,0.9,0.9548333857138904,0.34692463642902516,1.0
Hoe doe ik een repush voor RV?,"['Source: RV\n# RV\n\nVoici les étapes à suivre lorsque l’équipe RV demande d\'effectuer un repush:\n\n1. Ouvrir MyMinfin Civil Servant dans un écran incognito.\n\n2. Ouvrir un deuxième onglet et y mettre [http://www.finbel.intra/](http://www.finbel.intra/).\n\n3. Assurez-vous que vous disposez des informations suivantes:\n\n   - Application Type\n   - Status\n   - ID\n\n4. Dans le deuxième onglet, coller un lien avec la structure suivante derrière [http://www.finbel.intra/](http://www.finbel.intra/):\n\n   **Repush par ID**:\n\n   `myminfin-rest/myminfin-files-stirint/put-in-queue/{applicationType}/{status}/{id}`\n\n   Example: `myminfin-rest/myminfin-files-stirint/put-in-queue-by-id/WITHHOLDING_TAX/VALIDATED/***204832***`\n\n   Attention: Si vous obtenez l\'adresse complète du demandeur, veillez à ce qu\'il n\'y ait pas trop d\'espaces.\n\n5. Cliquer sur ENTER.\n\n6. Si tout s’est bien passé, le système vous renvoie un message de succès qui doit être combiné avec la mention de \'queued files: 1\'.\n\n   Example:\n\n   ```json\n   {\n     ""restMessages"": [\n       {\n         ""type"": ""SUCCESS"",\n         ""bundleKey"": ""queued files: 1"",\n         ""sticky"": false,\n         ""date"": ""2023-07-03T13:41:29.848+0000""\n       }\n     ],\n     ""mustRedirectToHome"": false,\n     ""sessionExpired"": false,\n     ""error"": false\n   }\n   ```\n\nSource: Treatment_incidents\n| **Onderwerp**                            | **Wie contacteren**                                                                                                                                                                                                                                                                                                                                                                                                                                                                                                                                                                                      |\n|------------------------------------------|----------------------------------------------------------------------------------------------------------------------------------------------------------------------------------------------------------------------------------------------------------------------------------------------------------------------------------------------------------------------------------------------------------------------------------------------------------------------------------------------------------------------------------------------------------------------------------------------------------|\n| (1) Authenticatie                        | Neem contact op met de **servicedesk** op 02 576 36 36. Als zij geen oplossing kunnen vinden, kan je een ticket openen bij de dienst **IAM ICT**.                                                                                                                                                                                                                                                                                                                                                                                                                                                        |\n\nSource: Rôles_Rollen\n## Comment retirer un document que je viens d’enregistrer via MMF - Ik wil een document verwijderen dat ik heb opgeladen via MMF\n\nSource: Contacts\n|             |                                                           |               |                                                                                                                                                                                          | **CONTENTIEUX/GESCHIL**: ICT - Group SNOW: FISC-GESCH-CONT-ICT, Service manager: Héloïse COULON, Business - Team manager: René VANDENHAUTE / backup: Caroline STARQUIT                                                                                                 | CH, Back-up: EB  |\n| 003         | Déclarer un véhicule (E705)                               | AGDA/AADA     | E705Rest, E705, immatriculation véhicule/voortuig inschrijven, achat à l\'étranger/aankoop in het buitenland                                                                              | ICT - Group SNOW: DA-ICT-E705, Service manager: Wa-Mbuna KOTO-NGBABO, Dev: Guillaume DENIS, Business - Expert: Simon BALLARINI                                                                                                                                         | OVB, Back-up: EB |\n| 004         | Précompte mobilier                                        |               |                                                                                                                                                                                          | ICT - Group SNOW: FISC-TRANSVERSAAL-ICT, Service manager: Michaël BAUWENS, Business - Expert: Rebecca DELPUTTE, Business analyst: Francis DIJSSELBLOEM, Support: rv-prmonweb@minfin.fed.be                                                                             | OVB, Back-up: EB |\n\nSource: Contacts\n| **Id** | **Fragment**                                                                                     | **AG/AA**     | **Keywords**                                                                                                                                                        | **ICT team**                                                                                                                                                      | |\n|--------|--------------------------------------------------------------------------------------------------|---------------|---------------------------------------------------------------------------------------------------------------------------------------------------------------------|-------------------------------------------------------------------------------------------------------------------------------------------------------------------|-|\n| 001    | Site Internet du SPF Finances                                                                    |               | Website van de FOD Financiën, Webseite des FÖD Finanzen                                                                                                             |                                                                                                                                                                   | |\n| 002    | Autres e-services du SPF Finances                                                                |               | Andere e-services van de FOD Financiën, Andere E-Dienste des FÖD Finanzen                                                                                           |                                                                                                                                                                   | |']","Ik heb genoeg informatie om je te helpen bij het repush voor RV. Volg deze stappen:

1. Opend MyMinfin Civil Servant in een incognitewijzer.
2. Open een tweede tabblad en voeg [http://www.finbel.intra/](http://www.finbel.intra/) toe.
3. Zorg ervoor dat je de volgende informatie hebt:
 * Application Type
 * Status
 * ID
4. In het tweede tabblad voeg je een link met de volgende structuur achter [http://www.finbel.intra/](http://www.finbel.intra/):
 **Repush par ID**:

`myminfin-rest/myminfin-files-stirint/put-in-queue/{applicationType}/{status}/{id}`

 Bijv. `myminfin-rest/myminfin-files-stirint/put-in-queue-by-id/WITHHOLDING_TAX/VALIDATED/***204832***`
5. Klik op ENTER.
6. Als alles goed is verlopen, krijg je een succesbericht met een message als volgt:
```json
{
  ""restMessages"": [
    {
      ""type"": ""SUCCESS"",
      ""bundleKey"": ""queued files: 1"",
      ""sticky"": false,
      ""date"": ""2023-07-03T13:41:29.848+0000""
    }
  ],
  ""mustRedirectToHome"": false,
  ""sessionExpired"": false,
  ""error"": false
}
```
 Als je nog hulp nodig hebt, kun je contact opnemen met de servicedesk op 02 576 36 36 of een ticket openen bij de dienst IAM ICT.

Bronnen:
- Treatment_incidents
- Rôles_Rollen
- Contacts","
        Hier zijn de stappen die gevolgd moeten worden wanneer het RV-team vraagt om een “repush” uit te voeren:
        
        1. Open MyMinfin Civil Servant in een incognitovenster.
        
        2.Open een tweede tabblad en zet er alvast: http://www.finbel.intra/
        
        3. Zorg ervoor dat u over de volgende informatie beschikt:
        
            - Application Type
            
            - Status
            
            - ID
        
        4. In het tweede tabblad, plak een link met de volgende structuur achter: http://www.finbel.intra/
        
        Repush via ID: myminfin-rest/myminfin-files-stirint/put-in-queue/{applicationType}/{status}/{id}
        
        Voorbeeld: myminfin-rest/myminfin-files-stirint/put-in-queue-by-id/WITHHOLDING_TAX/VALIDATED/204832
        
        Opmerking: Als u het volledige adres van de aanvrager krijgt, let er dan op dat er niet te veel spaties in staan.
        
        5. Druk op ENTER.
        
        6. Als alles goed verlopen is, geeft het systeem een succesbericht terug dat gecombineerd moet zijn met de melding 'queued files: 1'.
        
        Voorbeeld: {""restMessages"":[{""type"":""SUCCESS"",""bundleKey"":""queued files : 1"",""sticky"":false,""date"":""2023-07-03T13:41:29.848+0000""}],""mustRedirectToHome"":false,""sessionExpired"":false,""error"":false}
         ",0.8333333333333334,0.8989696590393969,0.8852821262802368,1.0
"Iemand wil een document verwijderen dat ik hij heeft opgeladen via MyMinfin, wat kan ik hierop antwoorden?","['Source: Rôles_Rollen\n| MYMINFIN ne stocke aucune donnée. Si le processus ne permet pas d\'annuler une demande, l\'utilisateur doit contacter le service qui a reçu le document.                                                                                                               | MYMINFIN slaat geen gegevens op. Als het proces niet toelaat om te annuleren, moet de gebruiker contact opnemen met de afdeling die het document heeft ontvangen.                                                                                                                |\n| J\'imagine que cela a été fait via ""Répondre à une lettre"" - dans ce cas, le client doit vous communiquer le code à trois chiffres qu\'il a utilisé et vous devez transmettre le ticket à l\'équipe SOH qui pourra vous dire quel est le service compétent à contacter. | Ik vermoed dat dit document is verstuurd via ""Antwoord op een brief"" - in dit geval moet de klant de gebruikte driecijferige code meedelen en moet je het ticket doorsturen naar het SOH-team. Die kunnen je vertellen met welke bevoegde service contact moet worden opgenomen. |\n| Nous ne pouvons donc pas vous aider pour ce cas.                                                                                                                                                                                                                     | Wij kunnen u niet helpen.                                                                                                                                                                                                                                                        |\n\nSource: Messages_Berichten\n| J\'ai reçu plusieurs courriers de l\'administration dans myminfin et j\'ai utilisé la fonction ""remplir le formulaire"" pour y répondre. Cependant, je ne retrouve pas ces réponses sur le site ni la preuve que je les ai envoyées. Comment puis-je les retrouver?                                                                                           | Ik ontving verschillende mails van de administratie in myminfin en ik gebruikte de functie ""formulier invullen"" om ze te beantwoorden. Ik kan deze reacties echter niet vinden op de site of bewijs dat ik ze heb verzonden. Hoe kan ik ze vinden?                                                                                                                               |\n| Ceci est une question administrative, pas technique. Pour répondre à la question : Tous les documents envoyés via la fonctionnalité ""remplir le document"" se retrouvent dans ""Mes Documents"". Ils sont liés au document de demande original. On les reconnaît à la petite flèche à côté du document qui donne accès à la correspondance envoyée et reçue. | Dit is een administratieve vraag, geen technische. Om op de vraag te antwoorden: Alle documenten die zijn verzonden via de functie ""document invullen"" zijn terug te vinden in ""Mijn documenten"". Ze zijn gekoppeld aan het originele aanvraagdocument. Ze zijn te herkennen aan het pijltje naast het document dat toegang geeft tot de verzonden en ontvangen correspondentie. |\n\nSource: Rôles_Rollen\n## Comment retirer un document que je viens d’enregistrer via MMF - Ik wil een document verwijderen dat ik heb opgeladen via MMF\n\nSource: Rôles_Rollen\n| Quand ceci sera fait, connectez-vous sur [www.myminfin.be](http://www.myminfin.be) et identifiez-vous ""au nom d\'une entreprise"". Sélectionnez votre entreprise (celle qui a signé le mandat avec le client), puis cliquez sur le lien ""Accéder au dossier d\'un client en tant que mandataire"" et enfin, sélectionnez votre client. | Eens dit gedaan is, kan u aanloggen op [www.myminfin.be](http://www.myminfin.be) en zich aanmelden “in naam van een onderneming”. Kies uw onderneming (die het mandaat met de klant getekend heeft), klik vervolgens op de link ""Het dossier van een klant raadplegen als mandaatnemer"", en dan kan u uw klant selecteren.                    |\n\nSource: Rôles_Rollen\n| Quand ceci sera fait, connectez-vous sur [www.myminfin.be](http://www.myminfin.be) et identifiez-vous ""au nom d\'une entreprise"". Sélectionnez votre entreprise (celle qui a signé le mandat avec le client), puis cliquez sur le lien ""Accéder au dossier d\'un client en tant que mandataire"" et enfin, sélectionnez votre client. | Eens dit gedaan is, kan u aanloggen op [www.myminfin.be](http://www.myminfin.be) en zich aanmelden “in naam van een onderneming”. Kies uw onderneming (die het mandaat met de klant getekend heeft), klik vervolgens op de link ""Het dossier van een klant raadplegen als mandaatnemer"", en dan kan u uw klant selecteren.                   |']","Ik heb genoeg informatie om je te helpen bij het verwijderen van een document dat je hebt opgeladen via MyMinfin.

Volgens de bronnen die ik heb, is het niet mogelijk om direct een document te verwijderen dat je hebt opgeladen via MyMinfin. Als je het document wilt verwijderen, moet je contact opnemen met de afdeling die het document heeft ontvangen (zoals vermeld in de bron ""Rôles_Rollen"").

Als je het document via de functie ""Répondre à une lettre"" of ""Antwoord op een brief"" hebt verzonden, moet je de gebruiker contact opnemen en de driecijferige code meedelen die hij heeft gebruikt. Je moet dan het ticket doorsturen naar het SOH-team, dat je kan vertellen welke bevoegde service je moet contacteren om het document te verwijderen.

Ik hoop dat dit helpt! Als je nog meer vragen hebt, voel je vrij om ze te stellen.","Je kan het volgende antwoorden: MYMINFIN slaat geen gegevens op. Als het proces niet toelaatom te annuleren, moet de gebruiker contact opnemen met de afdeling die het document heeft ontvangen.
    Ik vermoed dat dit document is verstuurd via Antwoord op een brief - in dit geval moet de klant de gebruikte driecijferige code meedelen en moet je het ticket doorsturen naar het SOH-team. Die kunnen je vertellen met welke bevoegde service contactmoet worden opgenomen .
    Wij kunnen u niet helpen.",0.4,0.9601163477561347,0.5281754175851453,1.0
"Een burger kan werkt bij een onderneming, maar kan niet inloggen in de naam van de onderneming, wat moet ik hierop antwoorden?","['Source: Rôles_Rollen\n| - donner/demander un rôle : [https://www.aideacces.be/44-Gestion_des_roles_eGov__RMA.html](https://www.aideacces.be/44-Gestion_des_roles_eGov__RMA.html)                                                                                                                             | - hoe toekennen of aanvragen van een rol : [https://www.loginhulp.be/44-NL.html](https://www.loginhulp.be/44-NL.html)                                                                                                                                                                         |\n| Quand ceci sera fait, connectez-vous sur [www.myminfin.be](http://www.myminfin.be) et identifiez-vous ""au nom d\'une entreprise"". Sélectionnez votre propre entreprise (ou sa filiale).                                                                                               | Eens dit in orde is, logt u aan op [www.myminfin.be](http://www.myminfin.be) en identificeert u zich “in naam van een onderneming”. Selecteer uw eigen onderneming (of een filiaal).                                                                                                          |\n\nSource: Rôles_Rollen\n| - donner/demander un rôle : [https://www.aideacces.be/44-Gestion_des_roles_eGov__RMA.html](https://www.aideacces.be/44-Gestion_des_roles_eGov__RMA.html)                                                                                                                             | - hoe toekennen of aanvragen van een rol : [https://www.loginhulp.be/44-NL.html](https://www.loginhulp.be/44-NL.html)                                                                                                                                                                         |\n| Quand ceci sera fait, connectez-vous sur [www.myminfin.be](http://www.myminfin.be) et identifiez-vous ""au nom d\'une entreprise"". Sélectionnez votre propre entreprise (ou sa filiale).                                                                                               | Eens dit in orde is, logt u aan op [www.myminfin.be](http://www.myminfin.be) en identificeert u zich “in naam van een onderneming”. Selecteer uw eigen onderneming (of een filiaal).                                                                                                          |\n                                                                                                          |\n\nSource: Rôles_Rollen\n## Je n’arrive pas à me connecter en nom de mon entreprise - Ik kan niet inloggen in naam van mijn eigen onderneming\n\nSource: Treatment_incidents\n1. s’identifier avec le user adéquat 2. aller dans Mes attributions de rôle / Afficher l’aperçu de vos attributions de\n   rôle (actuelles) |\n   | | - En\n   prod : [https://iamapps.belgium.be/hma/generalinfo?redirectUrl=%2Fhma](https://iamapps.belgium.be/hma/generalinfo?redirectUrl=%2Fhma) (\n   toujours se connecter avec son eid) → pour obtenir un accès, contacter Marc Dessart en lui envoyant le formulaire\n   suivant complété (FR) [demande-acces-application.docx](sharepoint.com) (NL) not found |\n   | | - Si la question vient d’un avocat → il faut la transférer\n   à [mandats.ict@minfin.fed.be](mailto:mandats.ict@minfin.fed.be) (pour info, la procédure pour créer un mandat\n   “avocat”\n   est expliquée sur la\n   page [https://finances.belgium.be/fr/experts_partenaires/avocats/avocats-administrateurs](https://finances.belgium.be/fr/experts_partenaires/avocats/avocats-administrateurs)) |\n   | | - Si l’utilisateur n’est pas connu dans SITRAN (cas typique : l’utilisateur a un numéro bis (mois de naissance =\n   00\n   ou >12) et a réussi à s’authentifier mais reçoit un message d’erreur sur chaque fonctionnalité) → demander l’ajout\n   dans\n   SITRAN à [sitran@minfin.fed.be](mailto:sitran@minfin.fed.be) |\n   | | - S’il s’agit d’un vrai problème technique chez\n   IAM : [ict-transv-iam@minfin.fed.be](mailto:ict-transv-iam@minfin.fed.be) |\n\nVider les caches : [myminfin-rest/tools/refresh-cache](myminfin-rest/tools/refresh-cache)\n\nSource: Rôles_Rollen\n### L\'utilisateur agit au nom de sa propre entreprise']","Het spijt me, maar ik heb genoeg informatie om een duidelijke antwoord te geven. Volgens het document ""Rôles_Rollen"" van MyMinfin kan een burger werken bij een onderneming, maar kan hij niet inloggen in de naam van de onderneming.

Om dit probleem op te lossen, moet je volgende stappen uitvoeren:

1. Verbind je met [www.myminfin.be](http://www.myminfin.be) en identificeer je jezelf ""au nom d'une entreprise"". 
2. Selecteer je eigen onderneming (of een filiaal).

Als je nog steeds problemen hebt, kun je contact opnemen met de volgende instanties:

- Marc Dessart: [mandats.ict@minfin.fed.be](mailto:mandats.ict@minfin.fed.be)
- SITRAN: [sitran@minfin.fed.be](mailto:sitran@minfin.fed.be) (als je niet bekend is in SITRAN)
- IAM: [ict-transv-iam@minfin.fed.be](mailto:ict-transv-iam@minfin.fed.be) (als het een technisch probleem is)

Je kunt ook de volgende stappen uitvoeren:

- Vider de caches: [myminfin-rest/tools/refresh-cache](myminfin-rest/tools/refresh-cache)

Ik hoop dat deze informatie je helpt om het probleem op te lossen.","Indien u niet de wettelijke vertegenwoordiger van deonderneming bent, hebt u een rol nodig om in te loggen inMYMINFIN in naam van uw eigen onderneming (inclusieffilialen).
            U wilt in MYMINFIN toegang tot :
            de berichten van de onderneming, dan hebt u de rol FODFIN Berichten van de onderneming nodig;
            de documenten en formaliteiten van de onderneming, danhebt u meestal genoeg aan de rol FOD Fin Aanstelling EigenOnderneming met één of meerdere parameters in functievan uw verantwoordelijkheden (bv. Om de BTW formaliteitente beheren, hebt u de parameter ‘Aanstelling BTW' nodig).
            Indien uw onderneming meerdere filialen telt, hebt u enkel derol nodig die volstaat voor elk van die ondernemingen. Vergeethet begrip ‘mandaten'. Die zijn niet nodig als het om uw eigenonderneming (inclusief filialen) gaat.
            Voor meer informatie kan u de volgende websites raadplegen :
            welke rol ik moet toekennen : 
            Rollen
            hoe toekennen of aanvragen van een rol :
            Beheer van detoegangsaanvragen in de rollenadministratie- RMA - Loginhulp.be
            Eens dit in orde is, logt u aan op MyMinfin en identificeert uzich “in naam van een onderneming”. 
            Selecteer uw eigen onderneming (of een filiaal).",0.6363636363636364,0.0,0.3497993963334004,0.375
Wat zijn de contactgegevens voor de hypoimage service?,"['Source: Treatment_incidents\n| **Problème**                             | **Équipe responsable et procédure**                                                                                                                                                                                                                                                                                                                                                                                                                                                                                                                                                                                                                                                                                                                                                                                                                                                                                                                                                                                                                                                                                                                                                                                                                                                                                                                                                                                                                                                                                                                                                                            |\n\nSource: Treatment_incidents\n| **Problème avec un serveur**          | Pour redémarrer un serveur : ouvrir un ticket SNOW ([https://fin.service-now.com/spf_fod/](https://fin.service-now.com/spf_fod/) + option Reboot)                                                                                                                                                                                  |\n|---------------------------------------|------------------------------------------------------------------------------------------------------------------------------------------------------------------------------------------------------------------------------------------------------------------------------------------------------------------------------------|\n| **PROD**                              | - Weblogic: mymiLothp011, mymiLothp021, mymiLothp031 of mymiLothp041<br>- Domain name: wlpoth1domain<br>- Cluster: mymiCluster<br>- Weblogic server name: lothp01, lothp02, lothp03 of lothp04                                                                                                                                     |\n| **ACC**                               | - Weblogic: mymiLotha011, mymiLotha021, mymiLotha031 of mymiLotha041<br>- Domain name: wltoth1domain<br>- Cluster: mymiCluster<br>- Weblogic server name: lotha01, lotha02, lotha03 and lotha04                                                                                                                                    |\n| **Problème avec VTOM**                | Ouvrir un ticket SNOW ([https://fin.service-now.com/spf_fod/](https://fin.service-now.com/spf_fod/) + option VTOM / application for adjustment VTOM job — en attendant un ticket spécifique pour les outages) et envoyer un mail à [ict.operations.vtom@minfin.fed.be](mailto:ict.operations.vtom@minfin.fed.be) avec la référence |\n\nSource: Treatment_incidents\n# 12. Liens Utiles | Nuttige Links | Nützliche Links\n\n| **Fonctionnalité**                                                    | **Backend**                                                                                                                                                                                                                                                           |\n|-----------------------------------------------------------------------|-----------------------------------------------------------------------------------------------------------------------------------------------------------------------------------------------------------------------------------------------------------------------|\n| **ubo-link**<br/>- Registre UBO<br/>- UBO-register<br/>- UBO-Register | - Service : **AGTRES** <br/> - Contacts : [sebastien.guillaume](mailto:sebastien.guillaume) (business - chef de projet) - ubobelgium (business - support 1e ligne - à contacter en priorité)                                                                          |\n| **Fisconetplus**                                                      | - Contacts : [luc.joosten@minfin.fed.be](mailto:luc.joosten@minfin.fed.be) (business) - [robin.sandra@inetum-realdolmen.world](mailto:robin.sandra@inetum-realdolmen.world) (Sharepoint - à contacter en cas de problèmes d’export (documents, images indisponibles)) |\n| **Mes Formulaires (finform)**                                         | - Pour toutes modifications dans les pdf statique dans Finform, vous pouvez envoyer vos demandes à [francoise.goffaux@minfin.fed.be](mailto:francoise.goffaux@minfin.fed.be) ou à Cellule de Communication.                                                           |\n\nSource: Treatment_incidents\n| group_baux : Contrats de location / Huurcontracten / Mietverträge <br/> group_el : Etat des lieux/ Plaatsbeschrijving / Ortsbefund | - Service : **AGDP - MYRENT**<br/>- Contacts : [dataquality.patdoc@minfin.fed.be](mailto:dataquality.patdoc@minfin.fed.be) ou **PATDOC-MyRent** (1e ligne) - [patrick.f.bottu@minfin.fed.be](mailto:patrick.f.bottu@minfin.fed.be) (ICT - service manager) - [cedric.micha@minfin.fed.be](mailto:cedric.micha@minfin.fed.be) (business - responsable service)                                       |                                                                                                                                                                                                                                                                                        |\n| group_el : Etat des lieux/ Plaatsbeschrijving / Ortsbefund                                                                         | - Service : **AGDP - HYPOIMAGE**<br/>- Contacts : [rzsj.operationeleondersteuning@minfin.fed.be](mailto:rzsj.operationeleondersteuning@minfin.fed.be) ou **PATDOC-RZSJ-Hypo** (1e ligne) - [andy.vanrompuy@minfin.fed.be](mailto:andy.vanrompuy@minfin.fed.be) (ICT - service manager ad interim) - [dirk.vanherrewegen@minfin.fed.be](mailto:dirk.vanherrewegen@minfin.fed.be) (ICT - développeur) | envoyer le mail à rzsj.operationeleondersteuning@minfin.fed.be / assigner le ticket au groupePATDOC-RZSJ-Hypo                                                                                                                                                                          |\n\nSource: Contacts\n| **Id** | **Fragment**                                                         | **AG/AA**     | **Keywords**                                                                                            | **ICT team**                                                                                                                                                                                                                             | **MMF**          |\n|--------|----------------------------------------------------------------------|---------------|---------------------------------------------------------------------------------------------------------|------------------------------------------------------------------------------------------------------------------------------------------------------------------------------------------------------------------------------------------|------------------|\n| 001    | Consulter mes dettes actuelles et remboursements                     | AGPR/AAII     | TaxBalancePortalRest, Tax balance, bilan fiscal, DAD                                                    | ICT - Group SNOW: IR-ICT-Team3, Service manager: Pascal CUVELIER, Business - Group SNOW: IR-DAD-Bus, Business analyst: Gaëlle VAN DE STEEN                                                                                               | CH, Back-up: OVB |\n| 002    | Demander un plan de paiement                                         | AGPR/AAII     | EPaymentPlanRest, plan de paiement/afbetalingsplan                                                      | ICT - Group SNOW: ![](image8.png), Service manager: An-Marie DHONT, Business - Group SNOW: IR-First-Bus, Business analyst: Sophie WATTILLON                                                                                              | OVB, Back-up: EB |']","Ik heb genoeg informatie om je te helpen bij je vraag. De contactgegevens voor de hypoimage service zijn:

* RZSJ operationele ondersteuning: rzsj.operationeleondersteuning@minfin.fed.be
* Andy van Rompuy (ICT-service manager ad interim): andy.vanrompuy@minfin.fed.be
* Dirk van Herrewegen (ICT-ontwikkelaar): dirk.vanherrewegen@minfin.fed.be

Referentie: Treatment_incidents, Source: AGDP - HYPOIMAGE","service : AGDP - HYPOIMAGE
contacts : rzsj.operationeleondersteuning@minfin.fed.be ou PATDOC-RZSJ-Hypo (1e ligne)
 - andy.vanrompuy@minfin.fed.be (ICT - servicemanager ad interim)
 - dirk.vanherrewegen@minfin.fed.be (ICT -développeur)",0.8571428571428571,0.934773664486678,0.691773200462861,1.0
