user_input,retrieved_contexts,response,reference,context_recall,faithfulness,factual_correctness(mode=f1)
Wie is de product owner van AGDP?,"[""| **Id**      | **Fragment**                                              | **AG/AA**     | **Keywords**                                                                                                                                                                             | **Project team**                                                                                                                                                                                                                                                       | **MMF**          |\n|-------------|-----------------------------------------------------------|---------------|------------------------------------------------------------------------------------------------------------------------------------------------------------------------------------------|------------------------------------------------------------------------------------------------------------------------------------------------------------------------------------------------------------------------------------------------------------------------|------------------|\n| 001         | Ma déclaration / Ma proposition de déclaration simplifiée | AGFISC/AAFISC | DeclarationStatusRest, IPP, INR, TOW, TaxOnWeb, Taxi, Dad, bulle, déclaration/aangifte, déclaration simplifiée/vereenvoudigde aangifte, PDS, avertissement extrait de rôle/aanslagbiljet | **BULLE 1 (TOW)**: ICT - Service Manager: Hans DE VLIEGER, Business - Group SNOW: FISC-PB, Business analyst: Sophie GULZAR                                                                                                                                             |                  |\n|             |                                                           |               |                                                                                                                                                                                          | **BULLE 2 (TAXI)**: ICT - Service Manager: Willem DE SWERT → Anne BEVERS, Business - Group SNOW: FISC-TAXI-BUS, Business analysts: Ahmed MESNAOUI, Pieterjan VANCANEYT, Alexander VERBEKE, Support: tow.taxworkbox@minfin.fed.be                                       |                  |\n|             |                                                           |               |                                                                                                                                                                                          | **BULLE 3 (DAD)**: ICT - Group SNOW: IR-ICT-Team3, Service manager: Pascal CUVELIER, Business - Business analyst: ![](image5.png)                                                                                                                                      | CH, Back-up: EB  |\n| 002         | Introduire et consulter une réclamation                   | AGFISC/AAFISC | LitigationRest, contentieux/geschil, réclamation/bezwaarschrift, Finaliti                                                                                                                | **FINALITI**: ICT - Group SNOW: FISC-FINALITI-ICT, Service manager: Héloïse COULON, Devs: GRP-MINFIN-finaliti@minfin.fed.be, Technical analyst: Renaud GILLEBERT, Business - Expert: Alain GHISLAIN, Business analysts: William SOREE, Steven PLANCK                   |                  |\n|             |                                                           |               |                                                                                                                                                                                          | **CONTENTIEUX/GESCHIL**: ICT - Group SNOW: FISC-GESCH-CONT-ICT, Service manager: Héloïse COULON, Business - Team manager: René VANDENHAUTE / backup: Caroline STARQUIT                                                                                                 | CH, Back-up: EB  |\n| 003         | Déclarer un véhicule (E705)                               | AGDA/AADA     | E705Rest, E705, immatriculation véhicule/voortuig inschrijven, achat à l'étranger/aankoop in het buitenland                                                                              | ICT - Group SNOW: DA-ICT-E705, Service manager: Wa-Mbuna KOTO-NGBABO, Dev: Guillaume DENIS, Business - Expert: Simon BALLARINI                                                                                                                                         | OVB, Back-up: EB |\n\n### L'utilisateur agit pour un client\n\n### L'utilisateur agit pour un client\n\n# Contacts\n\n-\n    1. Product owners, ABA, IAM & ICT\n-\n    2. Project teams\n\n    - 2.1. Ma déclaration|Mijn aangifte\n    - 2.2. Mes paiements|Mijn betalingen\n    - 2.3. Mon habitation|Mijn woning\n    - 2.4. Mes interactions|Mijn interacties\n    - 2.5. Mes outils professionnels|Mijn professionele toepassingen\n    - 2.6. Services intranet|Intranet diensten\n    - 2.7. Mes documents\n    - 2.8. Liens utiles|Nuttige links\n\n# 1. Product owners, ABA, IAM & ICT\n\n| **Administration** | **Product owners**                                     | **ABA**                               | **IAM**                          | **ICT**                                                                                                                                               |\n|--------------------|--------------------------------------------------------|---------------------------------------|----------------------------------|-------------------------------------------------------------------------------------------------------------------------------------------------------|\n| TRANS              | Ann Van Cauwenbergh (back up: Mannuel Van Der Helst ?) |                                       |                                  |                                                                                                                                                       |\n| AGFISC             | Brigitte Brucken (back up: Emmanuel Haubruge)          | aba-gab_fisc@minfin.fed.be            | iam.fisc@minfin.fed.be           | Manager: Hang-Pascale Phan-Thanh, Staff: Luca Romano, David Crespo Garcia, Philip Kurstjens, Bupa: Helena Van Roey, Architect: Francisco Javier Calvo |\n| AGPR               | Adil Soussi Nachit                                     | aaii-agpr.myminfin@minfin.fed.be      | iam.recovery@temp.minfin.be      | Manager: Martine Smet, Staff: Jan Van Ruyskensvelde, Bupa: Michel VAN HOEGAERDEN, Architect: ![](image1.png)                                          |\n| AGPD               | Kelly Fugarino (back up: Astrid Vervoort)              | myminfin.agdp_aapd@temp.minfin.fed.be | iam.ivu-cei.patdoc@minfin.fed.be | Manager: Vincent Kamanda, Staff: Yousra Haj Haddi, Najlae El Bouenani, Regis Gasper, Bupa: Cathy EMERY, Architect: ![](image2.png)                    |\n| AGDA               | Sarah Vanobberghen                                     |                                       | iam.da@temp.minfin.be            | Manager: Julien Cohen, Bupa: Brecht Desmet / Cynthia Lonneux ad interim, Architect: ![](image3.png)                                                   |\n| AGTRES             | Christophe Martin (back up: David Vandendriessche)     |                                       | iam.thesaurie@temp.minfin.be     | Manager: Jorre Vernelen                                                                                                                               |\n| ISI                | Mohamed Boulakhrif (back up: Dirk Deroey)              | aba.bbisi@minfin.fed.be               |                                  |                                                                                                                                                       |\n| ICT                | Christophe Martin (back up: ?)                         |                                       |                                  |                                                                                                                                                       |\n| ESS                | Luc Joosten                                            |                                       |                                  |                                                                                                                                                       |\n| COMM               | Fabrice De Gregorio                                    |                                       |                                  |                                                                                                                                                       |\n\nListe des personnes de contact à informer quand il y a une nouvelle release ou un problème majeur → boîte\nmyminfin-team (à tenir à jour)\n\n![Outlook Contact List](image4.png)\n\n# 2. Project teams\n\n## 2.1. Ma déclaration|Mijn aangifte""]",De product owner van AGDP is Kelly Fugarino.,De product owner van AGDP is Kelly Fugarino,1.0,0.0,1.0
Wie is de product owner van AGPR?,"[""### L'utilisateur agit pour un client\n\n### L'utilisateur agit pour un client\n\n# Contacts\n\n-\n    1. Product owners, ABA, IAM & ICT\n-\n    2. Project teams\n\n    - 2.1. Ma déclaration|Mijn aangifte\n    - 2.2. Mes paiements|Mijn betalingen\n    - 2.3. Mon habitation|Mijn woning\n    - 2.4. Mes interactions|Mijn interacties\n    - 2.5. Mes outils professionnels|Mijn professionele toepassingen\n    - 2.6. Services intranet|Intranet diensten\n    - 2.7. Mes documents\n    - 2.8. Liens utiles|Nuttige links\n\n# 1. Product owners, ABA, IAM & ICT\n\n| **Administration** | **Product owners**                                     | **ABA**                               | **IAM**                          | **ICT**                                                                                                                                               |\n|--------------------|--------------------------------------------------------|---------------------------------------|----------------------------------|-------------------------------------------------------------------------------------------------------------------------------------------------------|\n| TRANS              | Ann Van Cauwenbergh (back up: Mannuel Van Der Helst ?) |                                       |                                  |                                                                                                                                                       |\n| AGFISC             | Brigitte Brucken (back up: Emmanuel Haubruge)          | aba-gab_fisc@minfin.fed.be            | iam.fisc@minfin.fed.be           | Manager: Hang-Pascale Phan-Thanh, Staff: Luca Romano, David Crespo Garcia, Philip Kurstjens, Bupa: Helena Van Roey, Architect: Francisco Javier Calvo |\n| AGPR               | Adil Soussi Nachit                                     | aaii-agpr.myminfin@minfin.fed.be      | iam.recovery@temp.minfin.be      | Manager: Martine Smet, Staff: Jan Van Ruyskensvelde, Bupa: Michel VAN HOEGAERDEN, Architect: ![](image1.png)                                          |\n| AGPD               | Kelly Fugarino (back up: Astrid Vervoort)              | myminfin.agdp_aapd@temp.minfin.fed.be | iam.ivu-cei.patdoc@minfin.fed.be | Manager: Vincent Kamanda, Staff: Yousra Haj Haddi, Najlae El Bouenani, Regis Gasper, Bupa: Cathy EMERY, Architect: ![](image2.png)                    |\n| AGDA               | Sarah Vanobberghen                                     |                                       | iam.da@temp.minfin.be            | Manager: Julien Cohen, Bupa: Brecht Desmet / Cynthia Lonneux ad interim, Architect: ![](image3.png)                                                   |\n| AGTRES             | Christophe Martin (back up: David Vandendriessche)     |                                       | iam.thesaurie@temp.minfin.be     | Manager: Jorre Vernelen                                                                                                                               |\n| ISI                | Mohamed Boulakhrif (back up: Dirk Deroey)              | aba.bbisi@minfin.fed.be               |                                  |                                                                                                                                                       |\n| ICT                | Christophe Martin (back up: ?)                         |                                       |                                  |                                                                                                                                                       |\n| ESS                | Luc Joosten                                            |                                       |                                  |                                                                                                                                                       |\n| COMM               | Fabrice De Gregorio                                    |                                       |                                  |                                                                                                                                                       |\n\nListe des personnes de contact à informer quand il y a une nouvelle release ou un problème majeur → boîte\nmyminfin-team (à tenir à jour)\n\n![Outlook Contact List](image4.png)\n\n# 2. Project teams\n\n## 2.1. Ma déclaration|Mijn aangifte\n\n| (6) Demande d'amélioration            | Contactez **votre service ABA** qui analysera la situation.                                                                                                                                                                                                                                                                                                                                                                                                                                                                                                                                                                |\n| (7) BUCA, nouveau projet              | Contactez **votre product owner MYMINFIN** : <br> - AGFISC : Brigitte Brucken et Emmanuel Haubruge <br> - AGDA : Sarah Vanobberghen <br> - AGDP : Kelly Fugarino <br> - AGTRES : David Vandendriessche                                                                                                                                                                                                                                                                                                                                                                                                                     |""]",De product owner van AGPR is Adil Soussi Nachit.,De product owner van AGPR is Adil Soussi Nachit,1.0,1.0,1.0
