user_input,retrieved_contexts,response,reference,faithfulness,factual_correctness(mode=f1),answer_correctness,nv_accuracy
Wie is de product owner van AGDP?,"[""Document 1:\n# Contacts\n\n-\n    1. Product owners, ABA, IAM & ICT\n-\n    2. Project teams\n\n    - 2.1. Ma déclaration|Mijn aangifte\n    - 2.2. Mes paiements|Mijn betalingen\n    - 2.3. Mon habitation|Mijn woning\n    - 2.4. Mes interactions|Mijn interacties\n    - 2.5. Mes outils professionnels|Mijn professionele toepassingen\n    - 2.6. Services intranet|Intranet diensten\n    - 2.7. Mes documents\n    - 2.8. Liens utiles|Nuttige links\n\n# 1. Product owners, ABA, IAM & ICT\n\n| **Administration** | **Product owners**                                     | **ABA**                               | **IAM**                          | **ICT**                                                                                                                                               |\n|--------------------|--------------------------------------------------------|---------------------------------------|----------------------------------|-------------------------------------------------------------------------------------------------------------------------------------------------------|\n| TRANS              | Ann Van Cauwenbergh (back up: Mannuel Van Der Helst ?) |                                       |                                  |                                                                                                                                                       |\n| AGFISC             | Brigitte Brucken (back up: Emmanuel Haubruge)          | aba-gab_fisc@minfin.fed.be            | iam.fisc@minfin.fed.be           | Manager: Hang-Pascale Phan-Thanh, Staff: Luca Romano, David Crespo Garcia, Philip Kurstjens, Bupa: Helena Van Roey, Architect: Francisco Javier Calvo |\n| AGPR               | Adil Soussi Nachit                                     | aaii-agpr.myminfin@minfin.fed.be      | iam.recovery@temp.minfin.be      | Manager: Martine Smet, Staff: Jan Van Ruyskensvelde, Bupa: Michel VAN HOEGAERDEN, Architect: ![](image1.png)                                          |\n| AGPD               | Kelly Fugarino (back up: Astrid Vervoort)              | myminfin.agdp_aapd@temp.minfin.fed.be | iam.ivu-cei.patdoc@minfin.fed.be | Manager: Vincent Kamanda, Staff: Yousra Haj Haddi, Najlae El Bouenani, Regis Gasper, Bupa: Cathy EMERY, Architect: ![](image2.png)                    |\n| AGDA               | Sarah Vanobberghen                                     |                                       | iam.da@temp.minfin.be            | Manager: Julien Cohen, Bupa: Brecht Desmet / Cynthia Lonneux ad interim, Architect: ![](image3.png)                                                   |\n| AGTRES             | Christophe Martin (back up: David Vandendriessche)     |                                       | iam.thesaurie@temp.minfin.be     | Manager: Jorre Vernelen                                                                                                                               |\n| ISI                | Mohamed Boulakhrif (back up: Dirk Deroey)              | aba.bbisi@minfin.fed.be               |                                  |                                                                                                                                                       |\n| ICT                | Christophe Martin (back up: ?)                         |                                       |                                  |                                                                                                                                                       |\n| ESS                | Luc Joosten                                            |                                       |                                  |                                                                                                                                                       |\n| COMM               | Fabrice De Gregorio                                    |                                       |                                  |                                                                                                                                                       |\n\nListe des personnes de contact à informer quand il y a une nouvelle release ou un problème majeur → boîte\nmyminfin-team (à tenir à jour)\n\n![Outlook Contact List](image4.png)\n\n# 2. Project teams\n\n## 2.1. Ma déclaration|Mijn aangifte\n\nDocument 2:\n| (5) Technische problemen                 | Neem contact op met uw ABA-dienst, die zal samen met het bevoegde technische team het probleem analyseren. Indien nodig, nemen zij contact met ons.                                                                                                                                                                                                                                                                                                                                                                                                                                                      |\n| (6) Verbeteringsverzoeken                | Neem contact op met uw ABA-dienst, zij maken de analyse.                                                                                                                                                                                                                                                                                                                                                                                                                                                                                                                                                 |\n| (7) BUCA, nieuw project                  | Neem contact met uw MyMinfin Product owner: <br> - AAFISC : Brigitte Brucken en Emmanuel Haubruge <br> - ADDA : Sarah Vanobberghen <br> - AAPD : Kelly Fugarino <br> - AATHES : David Vandendriessche                                                                                                                                                                                                                                                                                                                                                                                                    |\n\nDocument 3:\n| 008         | Mes déclarations en douanes                               | AGDA/AADA     |                                                                                                                                                                                          |                                                                                                                                                                                                                                                                        |                  |\n| 008_01      | IDMS                                                      | AGDA/AADA     |                                                                                                                                                                                          | ICT - Group SNOW: DA-IDMS-ICT, Service manager: Valery PELLICHERO                                                                                                                                                                                                      | EB, Back-up: CH  |\n| 008_02      | PNTechnical                                               | AGDA/AADA     |                                                                                                                                                                                          | ICT - Group SNOW: DA-PNTS-ICT, Service manager: Yann PHILIPPE                                                                                                                                                                                                          | EB, Back-up: CH  |\n| 008_03      | NCTS                                                      | AGDA/AADA     |                                                                                                                                                                                          | ICT - Group SNOW: DA-ICT, Service manager: Meghraj RAMDOWAR                                                                                                                                                                                                            | EB, Back-up: CH  |\n| 008_04      | AES Technical                                             | AGDA/AADA     |                                                                                                                                                                                          | ICT - Group SNOW: ![](image6.png), Service manager: ![](image7.png)                                                                                                                                                                                                    | EB, Back-up: CH  |\n| 009         | Belcotax                                                  | AGFISC/AAFISC | 281, fiche fiscale, fiscale fiche, BOW, Belcotax                                                                                                                                         | ICT - Service manager: Christian SAIVE, Business - Group SNOW: FISC-PB, Business analyst: Laurent TITS                                                                                                                                                                 | CH, Back-up: EB  |\n| New project | tbd (PILLAR2)                                             | AGFISC/AAII   |                                                                                                                                                                                          | ICT - Group SNOW: ?, Service manager: Michaël BAUWENS, Technical analyst: Christian BASTIN, Dev: Christian BASTIN, Business - Expert: An REINERS, Business analysts: Mieke DAUWE/Thomas GENIE, Testers: Mieke DAUWE/Thomas GENIE, Contact list Outlook: AGFISC_PILLAR2 | EB, Back-up: CH  |\n\nDocument 4:\n## 3.2. Personnes de contact\n\nSi vous ne trouvez pas la personne ou l’adresse mail de contact dans le fichier MYMINFIN_fragments.xlsx, regardez dans\nle tableau ci-dessous. Un flag [(blauwe ster)] indique la personne ou l’adresse à privilégier. À contacter uniquement si\nla procédure au point 3.1 n’a rien donné ou pour organiser un meeting.\n\n## Structuur Contacten – ICT & Business\n\n### ️ Service Desk\n\n| **Côté ICT**                                                                                                                                                                                                     | **Côté Business**     |\n|------------------------------------------------------------------------------------------------------------------------------------------------------------------------------------------------------------------|-----------------------|\n| • Mail d'équipe : `grp-minfin-frontend@minfin.fed.be` *(enkel voor responsables)*<br>• Service Manager : **Marc Dessart**<br>• Team Manager NL : **Christophe Saelens**<br>• Team Manager FR : **Quentin Gommé** | *(geen vermeldingen)* |\n\n---\n\n### IAM\n\n| **Côté ICT**                                                                                                                                                                                                                                                                               | **Côté Business**                                                                                                                                                                                                                                                                                                                                                                                                                                                                                                                                                                                                                                                                                                    |\n|--------------------------------------------------------------------------------------------------------------------------------------------------------------------------------------------------------------------------------------------------------------------------------------------|----------------------------------------------------------------------------------------------------------------------------------------------------------------------------------------------------------------------------------------------------------------------------------------------------------------------------------------------------------------------------------------------------------------------------------------------------------------------------------------------------------------------------------------------------------------------------------------------------------------------------------------------------------------------------------------------------------------------|\n| • Mail : `ict-transv-iam@temp.minfin.be`<br>• Service Manager : **Patrick Colmant**<br>• Team Manager : **Luc Mathieu**<br>• Senior Dev : **Jean-Christophe Van Nieuwenhoven**<br>• Senior Analyst : **Olesya Lee**<br>• Matrix MyMinfin : **Michel Molitor** (`iam.ictBus@minfin.fed.be`) | **AG-specifieke matrices:**<br><br>🔸 **AGFISC**<br>• 📧 `iam.fisc@minfin.fed.be`<br>• Team Manager : **Pascale Phan-Thanh**<br>• Collab. : **Philip Kurstjens, David Crespo Garcia, Luca Romano**<br><br>🔸 **AGPR**<br>• 📧 `iam.recovery@minfin.fed.be`<br>• Team Manager : **Martine E.E. Smet**<br>• Collab. : **Jan H. Van Ruyskensvelde**<br><br>🔸 **AGDA**<br>• 📧 `iam.da@minfin.fed.be`<br>• Team Manager : **Julien Cohen**<br><br>🔸 **AGDP**<br>• 📧 `iam.ivu-cei.patdoc@minfin.fed.be`<br>• Team Manager : **Vincent Kamanda**<br>• Collab. : **Najlae El Bouenani, Régis Gasper, Joëlle Wathiong**<br><br>🔸 **AGTRES**<br>• 📧 `iam.thesaurie@minfin.fed.be`<br>• Team Manager : **Jorre Vernelen** |\n\n---\n\n### Mandats\n\n| **Côté ICT**                                                                                                                                               | **Côté Business**                                                                     |\n|------------------------------------------------------------------------------------------------------------------------------------------------------------|---------------------------------------------------------------------------------------|\n| • Mail : `team-ssm@minfin.fed.be`<br>• Service Manager : **Patrick Colmant**<br>• Senior Dev : **Matthieu Klass**<br>• Senior Analyst : **Simon Deroover** | • Project Manager : **Patrick Possemiers**<br>• Business Analyst : **Joseph De Neef** |\n\n---\n\n### Power BI\n\nDocument 5:\n| (5) Problème technique                | Contactez votre **service ABA** qui analysera le problème avec l'**équipe technique compétente** et nous contactera si nécessaire.                                                                                                                                                                                                                                                                                                                                                                                                                                                                                         |\n| (6) Demande d'amélioration            | Contactez **votre service ABA** qui analysera la situation.                                                                                                                                                                                                                                                                                                                                                                                                                                                                                                                                                                |\n| (7) BUCA, nouveau projet              | Contactez **votre product owner MYMINFIN** : <br> - AGFISC : Brigitte Brucken et Emmanuel Haubruge <br> - AGDA : Sarah Vanobberghen <br> - AGDP : Kelly Fugarino <br> - AGTRES : David Vandendriessche                                                                                                                                                                                                                                                                                                                                                                                                                     |""]","De product owner van AGDP is Kelly Fugarino, met Astrid Vervoort als back-up.",De product owner van AGDP is Kelly Fugarino,1.0,0.67,0.7416403341196037,0.75
Wie is de product owner van AGPR?,"[""Document 1:\n# Contacts\n\n-\n    1. Product owners, ABA, IAM & ICT\n-\n    2. Project teams\n\n    - 2.1. Ma déclaration|Mijn aangifte\n    - 2.2. Mes paiements|Mijn betalingen\n    - 2.3. Mon habitation|Mijn woning\n    - 2.4. Mes interactions|Mijn interacties\n    - 2.5. Mes outils professionnels|Mijn professionele toepassingen\n    - 2.6. Services intranet|Intranet diensten\n    - 2.7. Mes documents\n    - 2.8. Liens utiles|Nuttige links\n\n# 1. Product owners, ABA, IAM & ICT\n\n| **Administration** | **Product owners**                                     | **ABA**                               | **IAM**                          | **ICT**                                                                                                                                               |\n|--------------------|--------------------------------------------------------|---------------------------------------|----------------------------------|-------------------------------------------------------------------------------------------------------------------------------------------------------|\n| TRANS              | Ann Van Cauwenbergh (back up: Mannuel Van Der Helst ?) |                                       |                                  |                                                                                                                                                       |\n| AGFISC             | Brigitte Brucken (back up: Emmanuel Haubruge)          | aba-gab_fisc@minfin.fed.be            | iam.fisc@minfin.fed.be           | Manager: Hang-Pascale Phan-Thanh, Staff: Luca Romano, David Crespo Garcia, Philip Kurstjens, Bupa: Helena Van Roey, Architect: Francisco Javier Calvo |\n| AGPR               | Adil Soussi Nachit                                     | aaii-agpr.myminfin@minfin.fed.be      | iam.recovery@temp.minfin.be      | Manager: Martine Smet, Staff: Jan Van Ruyskensvelde, Bupa: Michel VAN HOEGAERDEN, Architect: ![](image1.png)                                          |\n| AGPD               | Kelly Fugarino (back up: Astrid Vervoort)              | myminfin.agdp_aapd@temp.minfin.fed.be | iam.ivu-cei.patdoc@minfin.fed.be | Manager: Vincent Kamanda, Staff: Yousra Haj Haddi, Najlae El Bouenani, Regis Gasper, Bupa: Cathy EMERY, Architect: ![](image2.png)                    |\n| AGDA               | Sarah Vanobberghen                                     |                                       | iam.da@temp.minfin.be            | Manager: Julien Cohen, Bupa: Brecht Desmet / Cynthia Lonneux ad interim, Architect: ![](image3.png)                                                   |\n| AGTRES             | Christophe Martin (back up: David Vandendriessche)     |                                       | iam.thesaurie@temp.minfin.be     | Manager: Jorre Vernelen                                                                                                                               |\n| ISI                | Mohamed Boulakhrif (back up: Dirk Deroey)              | aba.bbisi@minfin.fed.be               |                                  |                                                                                                                                                       |\n| ICT                | Christophe Martin (back up: ?)                         |                                       |                                  |                                                                                                                                                       |\n| ESS                | Luc Joosten                                            |                                       |                                  |                                                                                                                                                       |\n| COMM               | Fabrice De Gregorio                                    |                                       |                                  |                                                                                                                                                       |\n\nListe des personnes de contact à informer quand il y a une nouvelle release ou un problème majeur → boîte\nmyminfin-team (à tenir à jour)\n\n![Outlook Contact List](image4.png)\n\n# 2. Project teams\n\n## 2.1. Ma déclaration|Mijn aangifte\n\nDocument 2:\n| (5) Technische problemen                 | Neem contact op met uw ABA-dienst, die zal samen met het bevoegde technische team het probleem analyseren. Indien nodig, nemen zij contact met ons.                                                                                                                                                                                                                                                                                                                                                                                                                                                      |\n| (6) Verbeteringsverzoeken                | Neem contact op met uw ABA-dienst, zij maken de analyse.                                                                                                                                                                                                                                                                                                                                                                                                                                                                                                                                                 |\n| (7) BUCA, nieuw project                  | Neem contact met uw MyMinfin Product owner: <br> - AAFISC : Brigitte Brucken en Emmanuel Haubruge <br> - ADDA : Sarah Vanobberghen <br> - AAPD : Kelly Fugarino <br> - AATHES : David Vandendriessche                                                                                                                                                                                                                                                                                                                                                                                                    |\n\nDocument 3:\n## 3.2. Personnes de contact\n\nSi vous ne trouvez pas la personne ou l’adresse mail de contact dans le fichier MYMINFIN_fragments.xlsx, regardez dans\nle tableau ci-dessous. Un flag [(blauwe ster)] indique la personne ou l’adresse à privilégier. À contacter uniquement si\nla procédure au point 3.1 n’a rien donné ou pour organiser un meeting.\n\n## Structuur Contacten – ICT & Business\n\n### ️ Service Desk\n\n| **Côté ICT**                                                                                                                                                                                                     | **Côté Business**     |\n|------------------------------------------------------------------------------------------------------------------------------------------------------------------------------------------------------------------|-----------------------|\n| • Mail d'équipe : `grp-minfin-frontend@minfin.fed.be` *(enkel voor responsables)*<br>• Service Manager : **Marc Dessart**<br>• Team Manager NL : **Christophe Saelens**<br>• Team Manager FR : **Quentin Gommé** | *(geen vermeldingen)* |\n\n---\n\n### IAM\n\n| **Côté ICT**                                                                                                                                                                                                                                                                               | **Côté Business**                                                                                                                                                                                                                                                                                                                                                                                                                                                                                                                                                                                                                                                                                                    |\n|--------------------------------------------------------------------------------------------------------------------------------------------------------------------------------------------------------------------------------------------------------------------------------------------|----------------------------------------------------------------------------------------------------------------------------------------------------------------------------------------------------------------------------------------------------------------------------------------------------------------------------------------------------------------------------------------------------------------------------------------------------------------------------------------------------------------------------------------------------------------------------------------------------------------------------------------------------------------------------------------------------------------------|\n| • Mail : `ict-transv-iam@temp.minfin.be`<br>• Service Manager : **Patrick Colmant**<br>• Team Manager : **Luc Mathieu**<br>• Senior Dev : **Jean-Christophe Van Nieuwenhoven**<br>• Senior Analyst : **Olesya Lee**<br>• Matrix MyMinfin : **Michel Molitor** (`iam.ictBus@minfin.fed.be`) | **AG-specifieke matrices:**<br><br>🔸 **AGFISC**<br>• 📧 `iam.fisc@minfin.fed.be`<br>• Team Manager : **Pascale Phan-Thanh**<br>• Collab. : **Philip Kurstjens, David Crespo Garcia, Luca Romano**<br><br>🔸 **AGPR**<br>• 📧 `iam.recovery@minfin.fed.be`<br>• Team Manager : **Martine E.E. Smet**<br>• Collab. : **Jan H. Van Ruyskensvelde**<br><br>🔸 **AGDA**<br>• 📧 `iam.da@minfin.fed.be`<br>• Team Manager : **Julien Cohen**<br><br>🔸 **AGDP**<br>• 📧 `iam.ivu-cei.patdoc@minfin.fed.be`<br>• Team Manager : **Vincent Kamanda**<br>• Collab. : **Najlae El Bouenani, Régis Gasper, Joëlle Wathiong**<br><br>🔸 **AGTRES**<br>• 📧 `iam.thesaurie@minfin.fed.be`<br>• Team Manager : **Jorre Vernelen** |\n\n---\n\n### Mandats\n\n| **Côté ICT**                                                                                                                                               | **Côté Business**                                                                     |\n|------------------------------------------------------------------------------------------------------------------------------------------------------------|---------------------------------------------------------------------------------------|\n| • Mail : `team-ssm@minfin.fed.be`<br>• Service Manager : **Patrick Colmant**<br>• Senior Dev : **Matthieu Klass**<br>• Senior Analyst : **Simon Deroover** | • Project Manager : **Patrick Possemiers**<br>• Business Analyst : **Joseph De Neef** |\n\n---\n\n### Power BI\n\nDocument 4:\n| (5) Problème technique                | Contactez votre **service ABA** qui analysera le problème avec l'**équipe technique compétente** et nous contactera si nécessaire.                                                                                                                                                                                                                                                                                                                                                                                                                                                                                         |\n| (6) Demande d'amélioration            | Contactez **votre service ABA** qui analysera la situation.                                                                                                                                                                                                                                                                                                                                                                                                                                                                                                                                                                |\n| (7) BUCA, nouveau projet              | Contactez **votre product owner MYMINFIN** : <br> - AGFISC : Brigitte Brucken et Emmanuel Haubruge <br> - AGDA : Sarah Vanobberghen <br> - AGDP : Kelly Fugarino <br> - AGTRES : David Vandendriessche                                                                                                                                                                                                                                                                                                                                                                                                                     |\n\nDocument 5:\n| 008         | Mes déclarations en douanes                               | AGDA/AADA     |                                                                                                                                                                                          |                                                                                                                                                                                                                                                                        |                  |\n| 008_01      | IDMS                                                      | AGDA/AADA     |                                                                                                                                                                                          | ICT - Group SNOW: DA-IDMS-ICT, Service manager: Valery PELLICHERO                                                                                                                                                                                                      | EB, Back-up: CH  |\n| 008_02      | PNTechnical                                               | AGDA/AADA     |                                                                                                                                                                                          | ICT - Group SNOW: DA-PNTS-ICT, Service manager: Yann PHILIPPE                                                                                                                                                                                                          | EB, Back-up: CH  |\n| 008_03      | NCTS                                                      | AGDA/AADA     |                                                                                                                                                                                          | ICT - Group SNOW: DA-ICT, Service manager: Meghraj RAMDOWAR                                                                                                                                                                                                            | EB, Back-up: CH  |\n| 008_04      | AES Technical                                             | AGDA/AADA     |                                                                                                                                                                                          | ICT - Group SNOW: ![](image6.png), Service manager: ![](image7.png)                                                                                                                                                                                                    | EB, Back-up: CH  |\n| 009         | Belcotax                                                  | AGFISC/AAFISC | 281, fiche fiscale, fiscale fiche, BOW, Belcotax                                                                                                                                         | ICT - Service manager: Christian SAIVE, Business - Group SNOW: FISC-PB, Business analyst: Laurent TITS                                                                                                                                                                 | CH, Back-up: EB  |\n| New project | tbd (PILLAR2)                                             | AGFISC/AAII   |                                                                                                                                                                                          | ICT - Group SNOW: ?, Service manager: Michaël BAUWENS, Technical analyst: Christian BASTIN, Dev: Christian BASTIN, Business - Expert: An REINERS, Business analysts: Mieke DAUWE/Thomas GENIE, Testers: Mieke DAUWE/Thomas GENIE, Contact list Outlook: AGFISC_PILLAR2 | EB, Back-up: CH  |""]",De product owner van AGPR is Adil Soussi Nachit.,De product owner van AGPR is Adil Soussi Nachit,1.0,1.0,0.9969867779317368,1.0
