user_input,retrieved_contexts,response,reference,faithfulness,factual_correctness(mode=f1),answer_correctness,nv_accuracy
Wie is de product owner van AGDP?,"['Document 1:\n| AGPR               | Adil Soussi Nachit                                     | aaii-agpr.myminfin@minfin.fed.be      | iam.recovery@temp.minfin.be      | Manager: Martine Smet, Staff: Jan Van Ruyskensvelde, Bupa: Michel VAN HOEGAERDEN, Architect: ![](image1.png)                                          |\n| AGPD               | Kelly Fugarino (back up: Astrid Vervoort)              | myminfin.agdp_aapd@temp.minfin.fed.be | iam.ivu-cei.patdoc@minfin.fed.be | Manager: Vincent Kamanda, Staff: Yousra Haj Haddi, Najlae El Bouenani, Regis Gasper, Bupa: Cathy EMERY, Architect: ![](image2.png)                    |\n| AGDA               | Sarah Vanobberghen                                     |                                       | iam.da@temp.minfin.be            | Manager: Julien Cohen, Bupa: Brecht Desmet / Cynthia Lonneux ad interim, Architect: ![](image3.png)                                                   |\n| AGTRES             | Christophe Martin (back up: David Vandendriessche)     |                                       | iam.thesaurie@temp.minfin.be     | Manager: Jorre Vernelen                                                                                                                               |\n\nDocument 2:\n| (7) BUCA, nouveau projet              | Contactez **votre product owner MYMINFIN** : <br> - AGFISC : Brigitte Brucken et Emmanuel Haubruge <br> - AGDA : Sarah Vanobberghen <br> - AGDP : Kelly Fugarino <br> - AGTRES : David Vandendriessche                                                                                                                                                                                                                                                                                                                                                                                                                     |\n\nDocument 3:\n| **Administration** | **Product owners**                                     | **ABA**                               | **IAM**                          | **ICT**                                                                                                                                               |\n|--------------------|--------------------------------------------------------|---------------------------------------|----------------------------------|-------------------------------------------------------------------------------------------------------------------------------------------------------|\n| TRANS              | Ann Van Cauwenbergh (back up: Mannuel Van Der Helst ?) |                                       |                                  |                                                                                                                                                       |\n| AGFISC             | Brigitte Brucken (back up: Emmanuel Haubruge)          | aba-gab_fisc@minfin.fed.be            | iam.fisc@minfin.fed.be           | Manager: Hang-Pascale Phan-Thanh, Staff: Luca Romano, David Crespo Garcia, Philip Kurstjens, Bupa: Helena Van Roey, Architect: Francisco Javier Calvo |\n\nDocument 4:\n| new project | Tbd (use cases in GTM2)                                                                    | Services du Président/Diensten Voorzitter |                                                                                                                                                               | ICT - Architect: Marcel MENTEN, Service manager: Christophe JANSSENS, Business - Project manager: Mannuel VAN DER HELST, Business analyst: Adrian MIESSEN                                                                                                                                                           | CH, Back-up: EB  |']",De product owner van AGDP is Kelly Fugarino.,De product owner van AGDP is Kelly Fugarino,1.0,1.0,0.9980136633241342,1.0
Wie is de product owner van AGPR?,"['Document 1:\n| (7) BUCA, nouveau projet              | Contactez **votre product owner MYMINFIN** : <br> - AGFISC : Brigitte Brucken et Emmanuel Haubruge <br> - AGDA : Sarah Vanobberghen <br> - AGDP : Kelly Fugarino <br> - AGTRES : David Vandendriessche                                                                                                                                                                                                                                                                                                                                                                                                                     |\n\nDocument 2:\n| AGPR               | Adil Soussi Nachit                                     | aaii-agpr.myminfin@minfin.fed.be      | iam.recovery@temp.minfin.be      | Manager: Martine Smet, Staff: Jan Van Ruyskensvelde, Bupa: Michel VAN HOEGAERDEN, Architect: ![](image1.png)                                          |\n| AGPD               | Kelly Fugarino (back up: Astrid Vervoort)              | myminfin.agdp_aapd@temp.minfin.fed.be | iam.ivu-cei.patdoc@minfin.fed.be | Manager: Vincent Kamanda, Staff: Yousra Haj Haddi, Najlae El Bouenani, Regis Gasper, Bupa: Cathy EMERY, Architect: ![](image2.png)                    |\n| AGDA               | Sarah Vanobberghen                                     |                                       | iam.da@temp.minfin.be            | Manager: Julien Cohen, Bupa: Brecht Desmet / Cynthia Lonneux ad interim, Architect: ![](image3.png)                                                   |\n| AGTRES             | Christophe Martin (back up: David Vandendriessche)     |                                       | iam.thesaurie@temp.minfin.be     | Manager: Jorre Vernelen                                                                                                                               |\n\nDocument 3:\n| **Id** | **Fragment**                                                            | **AG/AA**     | **Keywords**                                                                                                  | **ICT team**                                                                                                                                                   |                  |\n|--------|-------------------------------------------------------------------------|---------------|---------------------------------------------------------------------------------------------------------------|----------------------------------------------------------------------------------------------------------------------------------------------------------------|------------------|\n| 001    | Intake générique Perception et Recouvrement                             | AGPR/AAII     | IntakeGenericRest                                                                                             | ICT - Group SNOW: IR-First-BUS, Service manager: Mathias Van De Broeck (back up: An-Marie DHONT), Business - Business analysts: Leslie ZADNICK, Anne SCHOELING | EB, Back-up: CH  |\n\nDocument 4:\n| New project | tbd (PILLAR2)                                             | AGFISC/AAII   |                                                                                                                                                                                          | ICT - Group SNOW: ?, Service manager: Michaël BAUWENS, Technical analyst: Christian BASTIN, Dev: Christian BASTIN, Business - Expert: An REINERS, Business analysts: Mieke DAUWE/Thomas GENIE, Testers: Mieke DAUWE/Thomas GENIE, Contact list Outlook: AGFISC_PILLAR2 | EB, Back-up: CH  |']",De product owner van AGPR is Adil Soussi Nachit.,De product owner van AGPR is Adil Soussi Nachit,0.0,1.0,0.9969950098223042,1.0
